author_id,name,affiliations,homepage,paper_count,citation_count,paper_id,title,year,venue,fields_of_study,reference_count,citation_count,author_id
2969386,"A. Spoerri",,NULL,32,931,536a0078bca75be16a38c41f38a642ff81c7cb05,"Visualizing the overlap between the 100 most visited pages on Wikipedia for September 2006 to January 2007",2007,"First Monday","Computer Science, Geography",0,10,2969386
47084399,"K. Costello",,NULL,31,583,539078b1c632f84772e400c402c91514c6a6a915,"How and why scholars cite on Twitter",2010,"ASIS&T Annual Meeting","Computer Science, Political Science",13,266,47084399
1767245,"M. Radford",,NULL,86,1504,53951274cfc75688bbbb31a616059a2a498608b5,"Through a Glass Darkly: Mediated and Non-Mediated Surveillance and Quality of Life Dimensions of Health",2006,,Psychology,0,0,1767245
5722419,"Maria K. Venetis",,NULL,55,946,54280ce046208732af463fa3a9becbefd78272af,"Communicating resilience: predictors and outcomes of dyadic communication resilience processes among both cancer patients and cancer partners",2020,,Psychology,60,28,5722419
1699369,"Venkata Rama Kiran Garimella",,NULL,72,2680,5429640b1ce9887e8564c4ff54831bf93d80c4bf,"Ad-blocking: A Study on Performance, Privacy and Counter-measures",2017,"Web Science Conference","Computer Science",11,44,1699369
1795976,"J. Pavlik",,NULL,116,2654,54443021bdc5f11587ecf4406b53835e53a030c9,"Situated documentaries: embedding multimedia presentations in the real world",1999,"Digest of Papers. Third International Symposium on Wearable Computers","Computer Science",23,215,1795976
1836413,"Melissa Aronczyk",,NULL,69,1109,54455bf5f71735c500343564a7928f8ae789d353,"Public Communication in a Promotional Culture",2020,,"Political Science",193,0,1836413
52100469,"J. Valenza",,NULL,62,88,549ba9a31862b652092f7d4b2e7bb071f59a3fe1,"Containers, genres, and formats, oh my: Creating sustainable concepts by connecting theory, research, practice, and education",2020,"ASIS&T Annual Meeting","Computer Science, Sociology",15,0,52100469
50981816,"Britt S. Paris",,NULL,37,215,5503547d07f48c78877bfd452736e0b34fd98575,"Performance, Identity and Immigration Law: A Theatre of Undocumentedness",2015,,Sociology,0,2,50981816
7495433,"Lea P. Stewart",,NULL,45,1097,55310fe1955c86d21792d955345c9043c040e307,"Extending the domain of instructional effectiveness assessment in student evaluations of communication courses",2000,,Psychology,27,42,7495433
73315821,"Brenda L. Boyer",,NULL,44,29,553e0f68834b3c3afa18984e946a184af9921bd2,"Chapter 10: Resources and Glossary",2014,,"Computer Science",0,0,73315821
1836413,"Melissa Aronczyk",,NULL,69,1109,5543cd59dd61846eef1e1ba55d5df7530dacabac,"National Belonging and Everyday Life: The Significance of Nationhood in an Uncertain World",2013,,Sociology,2,1,1836413
144147439,"Suchinthi Fernando",,NULL,7,25,5557a5fdbaf1dd27fafec8f1331531d6d760f9d7,"The Different Aspects of Information Security Education",2022,"Research Anthology on Advancements in Cybersecurity Education","Computer Science",13,0,144147439
1795976,"J. Pavlik",,NULL,116,2654,555b0373da1fd50d04fc83521bd35d0ad69e8e69,"Digital technology and journalism: implications for Democracy",2011,,"Political Science",0,8,1795976
1795976,"J. Pavlik",,NULL,116,2654,55eb4efce3195a0771811f68c1c4d29f0c645a08,"Hybrid technologies of tomorrow : transforming journalism, culture and commerce",1998,,"Political Science",0,0,1795976
2519847,"Mark Aakhus","Rutgers University",https://comminfo.rutgers.edu/aakhus-mark,101,3475,55f3c9057c3a2a87d2822027452542de4c2f4067,"What mediators do with words: Implementing three models of rational discussion in dispute mediation",2002,,Psychology,18,75,2519847
69362520,"J. R. Schement",,NULL,50,570,55fdd7b71513ca7f3404c1a05781215728d5e4cb,"The Onus of Minority Ownership: FCC Policy and Spanish-Language Radio",1981,,"Political Science",1,15,69362520
2519847,"Mark Aakhus","Rutgers University",https://comminfo.rutgers.edu/aakhus-mark,101,3475,5618e0249ef9da99360ab2586061293ac713edaf,"Layers of learning: facilitation in the distributed classroom",1997,"Proceedings of the Thirtieth Hawaii International Conference on System Sciences","Computer Science",19,11,2519847
13241733,"Galina B. Bolden",,NULL,56,2673,564463520ff5544a60b299518fd3eaa708f8503e,"Opening up closings in Russian",2017,,Sociology,19,14,13241733
3362498,"Shagun Jhaver",,NULL,38,1590,5690aa31aeb4f3d7f14313da1696de8e374fec0b,"Bans vs. Warning Labels: Examining Support for Community-wide Moderation Interventions",2023,arXiv.org,"Computer Science",72,0,3362498
2969386,"A. Spoerri",,NULL,32,931,56afe211e7c93b59ccf55f2d8d6015dffc1ed636,"InfoCrystal: A visual tool for information retrieval",1993,"Proceedings Visualization '93","Computer Science",46,333,2969386
1699369,"Venkata Rama Kiran Garimella",,NULL,72,2680,56bb1818f9c29e3cc5511c3d5bfc8e45d6b870b5,"Using Co-Following for Personalized Out-of-Context Twitter Friend Recommendation",2014,"International Conference on Web and Social Media","Computer Science",3,5,1699369
3026226,"Katherine Ognyanova",,NULL,138,1314,56ce4b5e42839c8a0437cdda5318f4693f66bf65,"Social Media Metrics in the Digital Marketplace of Attention: Does Journalistic Capital Matter for Social Media Capital?",2022,"Digital Journalism",,83,10,3026226
4770278,"Y. Rivera",,NULL,29,252,56f6551b885573309571b20612f62147fe991865,"The Expert Next Door: A Commentary on Interactions with Friends and Family During the SARS-CoV-2 Pandemic",2021,"American Journal of Epidemiology",Medicine,16,2,4770278
116703389,"K. White",,NULL,13,43,571c56a656a684e44b980a77339a51ad03e801e3,"Herman in Theory and Practice: Race and Power",2018,,Sociology,0,1,116703389
5947832,"Kristina M. Scharp",,NULL,75,1088,5732052981b6c37e545f071adce6c8263fd3577f,"Maintaining Open Adoption Relationships: Practitioner Insights on Adoptive Parents’ Regulation of Adoption Kinship Networks",2016,,Psychology,38,6,5947832
2519847,"Mark Aakhus","Rutgers University",https://comminfo.rutgers.edu/aakhus-mark,101,3475,57458120c88646dcdac8ee5198486701d86de4eb,"Basic Resources and Methods for Designing Public Argumentation",2020,,"Computer Science",0,0,2519847
116307858,"Regina M. Marchi",,NULL,33,470,57bb5b6a215513f9aa8542cad4da259d23ea78f8,"Reframing the runway",2005,,Sociology,26,19,116307858
2519847,"Mark Aakhus","Rutgers University",https://comminfo.rutgers.edu/aakhus-mark,101,3475,57bf9f3952b719acde6b4edb91b293ca2031afb9,"Engaging with Openness Through Common(s) Ground: Healthcare Innovation in the Networked Society",2017,"International Workshop on Bibliometric-enhanced Information Retrieval","Engineering, Computer Science",22,0,2519847
2604959,"L. Barkhuus",,NULL,109,3937,57ca8b8625815c04a4ea565040e7bc03c46893c1,"Panoramic video: design challenges and implications for content interaction",2013,"European Conference on Interactive TV","Computer Science",29,35,2604959
3362498,"Shagun Jhaver",,NULL,38,1590,57ed3397af003b4245ae9a127dfa7bf91fd66129,"Evaluating the Effectiveness of Deplatforming as a Moderation Strategy on Twitter",2021,"Proc. ACM Hum. Comput. Interact.","Computer Science",120,80,3362498
15910135,"Matthew D. Matsaganis",,NULL,45,512,5803f1f5903ada6e0e9068d73e2bb4f4e87aa460,"Ethnic Media in the Digital Age",2018,,Sociology,0,7,15910135
2468251,"Tawfiq Ammari",,NULL,30,1109,582177c3c5a1cca02b15c6f254babcaa6de4c06d,"Alternative Group Technologies and Their Influence on Group Technology Acceptance",2018,"American Journal of Information Systems","Computer Science",50,5,2468251
34881390,"S. Hull",,NULL,56,1009,5881a4b3f820a47e014cd654898a8a42f792459d,"The pre-exposure prophylaxis (PrEP) consciousness of black college women and the perceived hesitancy of public health institutions to curtail HIV in black women",2020,"BMC Public Health",Medicine,47,34,34881390
47084399,"K. Costello",,NULL,31,583,58d4994dea73a766c15cd686deeea6eee0a8fc3e,"Impact of patient‐provider communication on online health information behaviors in chronic illness",2016,"ASIS&T Annual Meeting","Psychology, Computer Science",40,19,47084399
34881390,"S. Hull",,NULL,56,1009,591875303c83bee11d9bb340ccfaef94fb282466,"Using Theory to Inform Practice: The Role of Formative Research in the Construction and Implementation of the Acceptance Journeys Social Marketing Campaign to Reduce Homophobia",2013,,,32,18,34881390
1699369,"Venkata Rama Kiran Garimella",,NULL,72,2680,5918c019b95eb5e7f37ecd82218050ff3cd72595,"Exploring Controversy in Twitter",2015,"CSCW Companion","Computer Science, Sociology",10,16,1699369
3026226,"Katherine Ognyanova",,NULL,138,1314,59204cb2c7f6fb7aa3b156a522314641d5a7e36c,"The COVID States Project #13: Public trust in institutions and vaccine acceptance",2021,,,0,1,3026226
2604959,"L. Barkhuus",,NULL,109,3937,5932ccf1ca09b9f16f9ba0fe3a69a8e5db2bc3c1,"Engaging the Crowd at Concert Events",2007,,,4,2,2604959
13241733,"Galina B. Bolden",,NULL,56,2673,594247ca0f69af109a80cff9275cc5cccf1d9cfe,"Implementing delayed actions",2009,,History,406,15,13241733
2459268,"Dafna Lemish",,NULL,149,2723,594e50cb13f68a00908994986f1354ee50077ca2,"Conflict, Media, and Child Well-Being 69",2014,,Sociology,46,0,2459268
116307858,"Regina M. Marchi",,NULL,33,470,597152172b5e6f6ae65ab29970fb03d85cecf12a,"Moving Forward: What We Can Do",2017,,,0,0,116307858
2604959,"L. Barkhuus",,NULL,109,3937,597463a41670dafdd4001339905da35275483dc2,"How to Define the Communication Situation : Context Measures in Present Mobile Telephony",2003,,,13,6,2604959
2519847,"Mark Aakhus","Rutgers University",https://comminfo.rutgers.edu/aakhus-mark,101,3475,59ab8ee2c1b165c99d45c7e4fb866a288707f396,"Argumentation in Complex Communication",2022,,,1,2,2519847
2824029,"N. Kranich",,NULL,47,305,59cc776d05629ae2d5ef803afe0060f701908fc8,"Safe/Brave Spaces: Engaging Future Citizens through School Libraries",2018,,"Political Science",1,0,2824029
1836413,"Melissa Aronczyk",,NULL,69,1109,5a1761106b0f76d7b91c217de7fbe44c5eb8ae5b,"Creative Tension, Normal Nation: Branding National Identity in Poland",2013,,"Political Science",0,0,1836413
3026226,"Katherine Ognyanova",,NULL,138,1314,5a25986ec9ea69fee1e8736a9990a979dfe7d836,"The COVID States Project #60: COVID-19 vaccine misinformation: From uncertainty to resistance",2021,,,0,10,3026226
1767245,"M. Radford",,NULL,86,1504,5a25d0dba6b4bf3bdc5ce2ad5adcc4d476c6f69a,"Seeking Synchronicity: Revelations and Recommendations for Virtual Reference.",2011,,"Computer Science",54,41,1767245
2604959,"L. Barkhuus",,NULL,109,3937,5a2e6143a0bc83b029d4026d210e6a94a1f2cf79,"Privacy in Location-Based Services , Concern vs . Coolness",2004,,,7,54,2604959
116703389,"K. White",,NULL,13,43,5a3268e3931a3eba4176f6faba095e25f52f0cfb,"One Man Hollywood: The Decline of Black Creative Production in Post-Network Television",2018,,History,0,3,116703389
144689908,"K. Greene",,NULL,153,5390,5a348391decef1799f5bf6a08a8e851e2ddcbe04,"Cognitive rationalizations for tanning-bed use: a preliminary exploration.",2013,"American Journal of Health Behavior","Psychology, Medicine",43,43,144689908
5722419,"Maria K. Venetis",,NULL,55,946,5a3c0d55a79e34f6dfa3a2069ec49f88c650b9a3,"Consultations between patients with breast cancer and surgeons: a pathway from patient-centered communication to reduced hopelessness.",2013,"Journal of Clinical Oncology",Medicine,66,64,5722419
2969386,"A. Spoerri",,NULL,32,931,5a5dac809309141b2ef8878a8c183734802f42f1,"Authority and ranking effects in data fusion",2008,"J. Assoc. Inf. Sci. Technol.","Computer Science",0,18,2969386
116307858,"Regina M. Marchi",,NULL,33,470,5aa3b5a4ef1b1d519333095a9f94ee5cb9dcaa7f,"Youth Citizen Journalism: The Connective Journalism Practices of Participation and Making the Story",2017,,"Political Science",0,0,116307858
15910135,"Matthew D. Matsaganis",,NULL,45,512,5aa61939c9e77c62a31db5d9d3af9486376ddf71,"How Do the Places We Live In Impact Our Health?: Challenges for, and Insights from, Communication Research",2015,,Sociology,108,3,15910135
13241733,"Galina B. Bolden",,NULL,56,2673,5ad75885c5b594cb8c9c609e5a6a6fd45694b50a,"Multiple modalities in collaborative turn sequences",2003,,Psychology,59,57,13241733
13241733,"Galina B. Bolden",,NULL,56,2673,5adfff83b01f9ab90c6a9d4bc3ebfad33e6d2062,"‘Articulating the unsaid’ via and-prefaced formulations of others’ talk",2010,,Psychology,69,107,13241733
2604959,"L. Barkhuus",,NULL,109,3937,5aecf70f8839f52c8f3ca7465024c194c37148be,"Interweaving mobile games with everyday life",2006,"International Conference on Human Factors in Computing Systems","Computer Science",20,319,2604959
52100469,"J. Valenza",,NULL,62,88,5af0663ff6e5cd94be7e4a825d7e093efcf5e582,"What’s in a Frame? Perspectives of high school librarians and first-year college students",2022,"College &amp; Research Libraries News",,0,0,52100469
1699369,"Venkata Rama Kiran Garimella",,NULL,72,2680,5afbbda067ec11447bc3c330d36598137a4acc89,"Quantifying Controversy on Social Media",2018,"ACM Transactions on Social Computing","Computer Science",52,81,1699369
50981816,"Britt S. Paris",,NULL,37,215,5b3f16b331dfbc33665db4583585d484cebddcf6,“Throughlines”,2020,"Transformative Digital Humanities",,0,0,50981816
7721216,"L. Mikesell",,NULL,54,834,5b47ee22d38e555af752a6561dc7b3c00b623987,"Strategies to support primary care involvement in the care of patients with a history of breast cancer: A Delphi study.",2023,"Journal of Clinical Oncology",,0,0,7721216
144689908,"K. Greene",,NULL,153,5390,5b57008ca24c47f479494f40d8850edfb3aeab91,"Unwanted Pursuit in Same-Sex Relationships: Effects of Attachment Styles, Investment Model Variables, and Sexual Minority Stressors",2011,"Partner Abuse",Psychology,50,42,144689908
2519847,"Mark Aakhus","Rutgers University",https://comminfo.rutgers.edu/aakhus-mark,101,3475,5b72c034727ba2877e18c9cde0962b1cfe229acc,"Information Systems for Symbolic Action: Social Media and Beyond",2012,,Sociology,37,15,2519847
5947832,"Kristina M. Scharp",,NULL,75,1088,5b752205f573f5071eb5ef58495d59e5a752ee7c,"Parent–Child Estrangement: Conditions for Disclosure and Perceived Social Network Member Reactions",2016,,Psychology,36,21,5947832
5722419,"Maria K. Venetis",,NULL,55,946,5b8dca5d8c66c5fa498450019cb70efb2b7a7cd6,"Social Network, Surgeon, and Media Influence on the Decision to Undergo Contralateral Prophylactic Mastectomy",2016,"American Journal of Clinical Oncology",Medicine,40,12,5722419
2824029,"N. Kranich",,NULL,47,305,5bff227d32ca05ad09c853822c7d4411ece704e6,"Libraries and Democracy Revisited",2020,"Library quarterly","Political Science",127,15,2824029
116007957,"Dajung Woo",,NULL,28,208,5c149ec28e29cb4c99c0dd893f08ae0bcc2a81f7,"Exit Strategies in Interorganizational Collaboration: Setting the Stage for Re-Entry",2019,"Communication Research",Business,37,11,116007957
3651083,"Itzhak Yanovitzky",,NULL,43,1734,5c17f6a71dea239406f1cc6db40b3b92c60d8145,"Sensation Seeking and Alcohol Use by College Students: Examining Multiple Pathways of Effects",2006,"Journal of health communication","Psychology, Medicine",51,69,3651083
69362520,"J. R. Schement",,NULL,50,570,5c4d3a200bca9c13319bdb7f679daca53f0db91b,"Democracy digitized: A national information infrastructure is essential",2008,,"Political Science",0,0,69362520
116307858,"Regina M. Marchi",,NULL,33,470,5ca54248183e02b9a798d791a6697a10ad0fc18e,"From disillusion to engagement: Minority teen journalists and the news media",2012,,"Political Science",45,12,116307858
2604959,"L. Barkhuus",,NULL,109,3937,5d2edf9eb41196d0cc5ac16088e36961a3d5861b,"Musicians' initial encounters with a smart guitar",2018,"Nordic Conference on Human-Computer Interaction","Psychology, Computer Science",60,5,2604959
73315821,"Brenda L. Boyer",,NULL,44,29,5d469e19d2d78ed63dbe49f0ff83e1d734b1b6fa,"LibGuides. KAHS Subject Guides. Evolution vs. Intelligent Design.",2012,,"Computer Science",0,0,73315821
2459268,"Dafna Lemish",,NULL,149,2723,5d4c84ffb276dcd70be46ba968ab0e8ee00157c9,"Media and Early Childhood Development",2013,,Medicine,0,1,2459268
3026226,"Katherine Ognyanova",,NULL,138,1314,5d4f59064711131b03b2693e3253dd51d9d5b6b6,"Network Approaches to Misinformation Evaluation and Correction",2021,"Networks, Knowledge Brokers, and the Public Policymaking Process",,79,4,3026226
2604959,"L. Barkhuus",,NULL,109,3937,5d9c07393f4bcf56806cb7197f7e4a5a955d150f,"Watching the footwork: second screen interaction at a dance and music performance",2014,"International Conference on Human Factors in Computing Systems","Computer Science",39,18,2604959
1699369,"Venkata Rama Kiran Garimella",,NULL,72,2680,5d9e5e9bbab8ab353c9f80bf39b947937df359c0,"Segregation and Sentiment: Estimating Refugee Segregation and Its Effects Using Digital Trace Data",2019,"Data for Refugees Challenge","Political Science, Computer Science",23,8,1699369
2969386,"A. Spoerri",,NULL,32,931,5dd530b4dc029805cd6990184052d135c3a8f646,"Souvenir: flexible note-taking tool to pinpoint and share media in digital libraries",2002,"ACM/IEEE Joint Conference on Digital Libraries","Computer Science",0,5,2969386
2459268,"Dafna Lemish",,NULL,149,2723,5de3d39cd55a5b2c81a4a3745dd87ba9d44ca6b0,"Screening Gender on Children's Television: The Views of Producers around the World",2010,,Sociology,0,67,2459268
2519847,"Mark Aakhus","Rutgers University",https://comminfo.rutgers.edu/aakhus-mark,101,3475,5de9430bc8c77ae179889827363c1b9b213b3cee,"Digital Innovation as Design of Digital Practice: Doctors as Designers in Healthcare",2018,"Hawaii International Conference on System Sciences","Computer Science, Business",23,5,2519847
3459190,"C. Senteio",,NULL,43,340,5e08a6d4533b0c17a680f7aa5ba891f7389eb340,"Community-Based Participatory Approach to Reduce Breast Cancer Disparities in South Dallas",2012,,,0,0,3459190
3026226,"Katherine Ognyanova",,NULL,138,1314,5e0cf05a6bda46460ed1d5a981ab5fea88590d67,"The COVID States Project #80: Americans' views on violence against the government",2022,,,0,2,3026226
1836413,"Melissa Aronczyk",,NULL,69,1109,5e15d4233318f2efe8479c69e0d0e4f65b584fc2,"From Bland to Brand: Transforming Canadian Culture",2013,,Sociology,0,0,1836413
69362520,"J. R. Schement",,NULL,50,570,5e1cad8a1653b6e465a6a9328745638af4ed3983,"Competing Visions, Complex Realities: Social Aspects of the Information Society",1987,,Sociology,0,37,69362520
5924217,"J. Mandelbaum",,NULL,33,892,5e20de4bec683bbbdb313efc8fcfd70708be47d1,"Studies in Language and Social Interaction: In Honor of Robert Hopper",2003,,Psychology,0,40,5924217
4770278,"Y. Rivera",,NULL,29,252,5e2c0b5b2180864acd3851b34dcbb53f95d78df8,"Abstract A56: Sustainability and health education: Training public health students to deliver cancer information in Puerto Rico",2016,,Medicine,0,0,4770278
2604959,"L. Barkhuus",,NULL,109,3937,5e857665055d8cece925908cd271b1b38f196caf,"TagPad: Supporting Field Interviews and Analysis Nis Bornoe",2013,,Psychology,12,0,2604959
2604959,"L. Barkhuus",,NULL,109,3937,5ef717956e33a7bcd25657bbd6359f0bcd6d6559,"Session details: Papers: managing social media",2013,"International Conference on Human Factors in Computing Systems",Sociology,0,0,2604959
15910135,"Matthew D. Matsaganis",,NULL,45,512,5f5e6554f8f5c0cc50b9d8d2914e6304320a64e8,"Individual Participation in Organizational Information Commons",2005,,Psychology,31,35,15910135
3651083,"Itzhak Yanovitzky",,NULL,43,1734,5f60ac9377920f840b9448b71f1cb76bd25ef8ef,"COMMUNITY-ENGAGED PEDAGOGY BY DESIGN: PRACTICAL STRATEGIES FOR PROMOTING TRANSFORMATIVE LEARNING",2023,"EDULEARN Proceedings",,0,0,3651083
3247454,"M. Chayko",,NULL,20,399,5fbf2e7a11c80b7effd6f580069ad7676c2e55bc,"The portable community: envisioning and examining mobile social connectedness",2007,"Int. J. Web Based Communities","Sociology, Computer Science",63,36,3247454
1795976,"J. Pavlik",,NULL,116,2654,5fc2b68546518d76164e9739fc566f8e9587102b,"News at Work: Imitation in an Age of Information Abundance By Pablo J. Boczkowski University of Chicago Press. 2010. 272 pages. $75 cloth, $27.50 paper",2011,,Sociology,0,0,1795976
2519847,"Mark Aakhus","Rutgers University",https://comminfo.rutgers.edu/aakhus-mark,101,3475,5ff8c089d792fbdcfe5727c0a809dab39629c7fb,"Argumentation support : From technology to tools",2003,,"Computer Science",0,6,2519847
73315821,"Brenda L. Boyer",,NULL,44,29,602d41a1089c3415f86ceadf0cced84ce47e6186,"Chapter 8: Curation Platforms",2014,,"Computer Science",0,2,73315821
3651083,"Itzhak Yanovitzky",,NULL,43,1734,605124e6d732b8b9bdb75c2741e1927e16680c1b,"News Media as Research Brokers",2017,,Business,0,0,3651083
52100469,"J. Valenza",,NULL,62,88,60719d6b31e3f1baffb444e9f622627aeb71b3fe,"Science and News: A Study of Students' Judgments of Online Scientific News Information.",2019,,Psychology,35,2,52100469
2855416,"Marija Dalbello",,NULL,45,296,6087c4b5d68e0277e9469000ffb4a2e0b02bf98e,"Editorial : Archaeology and information research",2019,,Sociology,31,1,2855416
34881390,"S. Hull",,NULL,56,1009,60cc012bb87f6a07ec39e7edc40695697b7b3054,"Stigmatizing Spaces and Places as Axes of Intersectional Stigma Among Sexual Minority Men in HIV Prevention Research.",2022,"American Journal of Public Health",Medicine,6,2,34881390
13241733,"Galina B. Bolden",,NULL,56,2673,60d560ef267c49c967fee1114b5007f315fc9455,"The quote and beyond: defining boundaries of reported speech in conversational Russian",2004,,Psychology,67,66,13241733
144689908,"K. Greene",,NULL,153,5390,615282785d5bf202b718b25a1cf3745ffeaeb25a,"Sensation Seeking and Adolescent Cigarette Smoking: Examining Multiple Pathways in Cross-Sectional Data",2009,,Psychology,57,19,144689908
144689908,"K. Greene",,NULL,153,5390,6164539f19a40af8afce65580604d38ec1cc3c18,"143 A Youth-Led Digital Education Intervention to Improve Blood Pressure for Adults Who Present to the Emergency Department with Hypertension",2022,"Journal of Clinical and Translational Science",,0,0,144689908
47084399,"K. Costello",,NULL,31,583,6193e589f8aba6bef77c1786fb898704e2e65796,"Building a Bigger Table: Food Research, Methods, Policy, and Action in Library and Information Science",2023,"Proceedings of the Association for Information Science and Technology",,20,0,47084399
84651025,"Ralph A. Gigliotti",,NULL,58,460,619ab9566eb1ad35fd30169bc0d25e10ee7a96ba,"Leadership, Communication, and Social Influence",2019,,"Psychology, Sociology",0,6,84651025
2898940,"Marya L. Doerfel",,NULL,43,1692,61a7978c839ef03663e6e1dbb6f14d15d9358f2c,"The Evolution of Networks and the Resilience of Interorganizational Relationships after Disaster",2013,,Sociology,59,77,2898940
2519847,"Mark Aakhus","Rutgers University",https://comminfo.rutgers.edu/aakhus-mark,101,3475,61bcda0971dadbab5a3ad0e5af1cbb2154f2253b,"1 Introduction : framing the issues",2004,,,0,0,2519847
7495433,"Lea P. Stewart",,NULL,45,1097,61c9588597e23cece5bc3282b9db7f4db1acc7ff,"A field test of Festinger's substitute locomotion theory",1986,,Psychology,8,1,7495433
47084399,"K. Costello",,NULL,31,583,6204f2be0ce28319095206a55e4d23bb135af057,"A spectrum of approaches to health information interaction: From avoidance to verification",2019,"J. Assoc. Inf. Sci. Technol.","Computer Science, Psychology",75,12,47084399
1795976,"J. Pavlik",,NULL,116,2654,620b62c1f3f2bf77e7074e2fadf16f0bb3826910,"Journalism and new technology: an uneasy alliance",2006,,"Political Science",0,1,1795976
5947832,"Kristina M. Scharp",,NULL,75,1088,622acd09d1e610180a4ee78af9e804e53b80bba8,"Family Communication Patterns and the Mediating Effects of Support and Resilience on Students' Concerns About College",2020,"Family Relations",Psychology,41,14,5947832
5722419,"Maria K. Venetis",,NULL,55,946,624731f1a6eafd3e1b8e4a9a28857703bdf11e71,"Provider Information Provision and Breast Cancer Patient Well-Being",2019,"Health Communication",Medicine,41,11,5722419
2459268,"Dafna Lemish",,NULL,149,2723,624f91b4df1ea7d62c61f20ae23817f23ae42cfe,"“WHAT REALLY ANNOYS ME ABOUT THE WAY GIRLS AND BOYS ARE PORTRAYED IN CHILDREN’S TELEVISION”",2012,,Psychology,0,1,2459268
34881390,"S. Hull",,NULL,56,1009,62542a25c4436a0fcec02eb7880403aa8c5dc5a3,"1716Engagement in OutSmart Flu, a smartphone-based surveillance system for influenza-like illness among students on a university campus",2014,"Open Forum Infectious Diseases",Medicine,0,0,34881390
2459268,"Dafna Lemish",,NULL,149,2723,625c627102383194c043413a93b4af5d7195c1ea,"The ultimate treat? Young Israeli children’s media use under their grandparents’ care",2019,"Journal of Children and Media",Psychology,48,11,2459268
84651025,"Ralph A. Gigliotti",,NULL,58,460,627c22994d9b7c9129bcca68497a8bae680f604b,"Cultivating Dialogue:A CentralImperative for the Study and Practiceof Servant Leadership",2016,,"Political Science",0,1,84651025
2459268,"Dafna Lemish",,NULL,149,2723,62809227242fa21a5bfebac804eb7f445266362f,"Fiery gingers",2018,"Feminist Interrogations of Women’s Head Hair",,0,4,2459268
2459268,"Dafna Lemish",,NULL,149,2723,62ec2ed05267fafa23aa081d6795f018a779380c,"Inhabiting two worlds",2014,,Sociology,53,4,2459268
7721216,"L. Mikesell",,NULL,54,834,6301f6e000bd150a2b6e417dae37f6792d549d32,"Medicinal relationships: caring conversation",2013,"Medical Education","Psychology, Medicine",92,48,7721216
5255291,"Jennifer A. Theiss",,NULL,95,2177,6306a295643dc8454275c0f4d0cc164592d98505,"Emotion regulation and resilience in parent–adolescent interactions among families of harmful versus non-harmful parental alcohol use",2019,"Journal of applied communications research",Psychology,70,6,5255291
3026226,"Katherine Ognyanova",,NULL,138,1314,639ab969a1aed6b132fb8aba2a9fa3a82173895b,"The COVID States Project #23: Depression among young adults",2021,,,0,3,3026226
7721216,"L. Mikesell",,NULL,54,834,63bdc0e4b8ce5a60fc1c34d00d05848becd86905,"Attending to Parent and Child Rights to Make Medication Decisions During Pediatric Psychiatry Visits",2020,,Psychology,57,2,7721216
144689908,"K. Greene",,NULL,153,5390,63e1bd4e7aac62000afe95384715d63549824619,"Conflicting views during gynecologic cancer care: a comparison of patients’ and caregivers’ perceptions of burden",2022,"Supportive Care in Cancer",Medicine,38,2,144689908
