author_id,name,affiliations,homepage,paper_count,citation_count,paper_id,title,year,venue,fields_of_study,reference_count,citation_count,author_id
3459190,"C. Senteio",,NULL,43,340,1d8e922238f5f8e958f3ba77a9d67fe002185355,"Count Me Out: Perceptions of Black Patients Who are on Dialysis but Who are Not on a Transplant Waitlist",2021,"Health Communication",Medicine,42,4,3459190
5255291,"Jennifer A. Theiss",,NULL,95,2177,1da374fcbe77b4fe48a32923ab915f4fc7936133,"Emotions and Communication",2022,"Interpersonal Communication",,0,0,5255291
1699369,"Venkata Rama Kiran Garimella",,NULL,72,2680,1dadc9ec08b64b058623243294f8d67352460561,"WhatsApp, Doc? A First Look at WhatsApp Public Group Data",2018,"International Conference on Web and Social Media","Computer Science, Political Science",31,63,1699369
84651025,"Ralph A. Gigliotti",,NULL,58,460,1db5005e0536e26877c1a4f9c99e0f83a9df53ad,"An Introduction to Leadership, Communication, and Social Influence",2019,"Leadership, Communication, and Social Influence",Sociology,0,1,84651025
48264400,"Lauren A. Feldman",,NULL,66,3292,1df560f45d5f5d097c85872e661d5b676f1b8463,"An Attack on Science?: Media Use, Trust in Scientists, and Perceptions about Global Warming (Top 3 Faculty Paper, Also Featured in Virtual Conference)",2012,,"Political Science",0,0,48264400
2898940,"Marya L. Doerfel",,NULL,43,1692,1e03868ee23cab750c47d067e788f0dd91222167,"Clique to Win: Impact of Cliques, Competition, and Resources on Team Performance",2022,"Journal of construction engineering and management",,35,3,2898940
69362520,"J. R. Schement",,NULL,50,570,1e075116448bf7096a5714d1ec639a4c195e097e,"Toward an Analysis of Household Information Consumption as a Dimension of the Emerging Information Infrastructure",1996,,Economics,6,1,69362520
2855416,"Marija Dalbello",,NULL,45,296,1e164772e6b9cb3ff5a513774b29c16fc534ce56,"How neutral can technology be?",2006,"ASIS&T Annual Meeting","Sociology, Computer Science",0,2,2855416
144689908,"K. Greene",,NULL,153,5390,1e33ff339bd8e2958fdc4d189552830199c1e4b9,"Aligned and Divergent Perceptions of Support Persons’ Role in Triadic Gynecologic Cancer Communication",2022,"Qualitative Health Research",Medicine,38,1,144689908
5255291,"Jennifer A. Theiss",,NULL,95,2177,1e7db20054426c517475e2da0366f6fa856e10ed,"Parent’s alcoholism severity and family topic avoidance about alcohol as predictors of perceived stigma among adult children of alcoholics: Implications for emotional and psychological resilience",2016,"Health Communication","Psychology, Medicine",90,34,5255291
73315821,"Brenda L. Boyer",,NULL,44,29,1e8d4a9ee4ea261d8f2d57c9ba29af9482bf0e84,"LibGuides. KASD Teacher Resources. Copyright, Fair Use, Creative Commons.",2013,,"Political Science",0,0,73315821
3651083,"Itzhak Yanovitzky",,NULL,43,1734,1ed2c3d39c0f71cfa465c26b0c3ebccbd2360a71,"A Multiyear Assessment of Public Response to a Statewide Drug Take-Back and Disposal Campaign, 2010 to 2012",2017,"Health Education & Behavior",Medicine,20,10,3651083
5947832,"Kristina M. Scharp",,NULL,75,1088,1f132189aa454925a440138e0dc72c4246892755,"Making Meaning of Domestic Adoption Reunion in Online Narratives",2013,,Sociology,31,13,5947832
14634426,"Sarah Shugars",,NULL,25,196,1f134e12b9e33748592d5e80db4316cf93cba441,"Supplemental Material for How Expertise Mediates the Effects of Numerical and Textual Communication on Individual and Collective Accuracy",2023,Decision,,0,0,14634426
2898940,"Marya L. Doerfel",,NULL,43,1692,1f15babece839b077966b936f405b8dde9647280,"What Constitutes Semantic Network Analysis? A Comparison of Research and Methodologies'",2003,,,26,148,2898940
1767245,"M. Radford",,NULL,86,1504,1f2a733063cc9154e8641ff4f942e24b86007cf1,"Measuring the Impacts of Government ICT Strategies",2016,,Business,0,0,1767245
1767245,"M. Radford",,NULL,86,1504,1f5ff2ce090894aaec6058d84c3852c0b231eecf,""People are reading your work, " scholarly identity and social networking sites",2020,"J. Documentation","Computer Science, Sociology",60,7,1767245
5947832,"Kristina M. Scharp",,NULL,75,1088,1f811cc30019c44254af899b0a348ef90bfc5746,"Assessing Organizational Cultural Responsiveness among Refugee-Servicing Domestic Violence Agencies",2020,,"Political Science",21,3,5947832
2459268,"Dafna Lemish",,NULL,149,2723,1f878cb90d8234bbf19ac35039c9e6f2545b84bb,"Factors Explaining Grandparental Mediation of Children’s Media Use in Two National Contexts",2020,"Television & New Media",Psychology,55,6,2459268
5255291,"Jennifer A. Theiss",,NULL,95,2177,1faaab0326bba2e530c8aa1791f485dfe0b9ce28,"A Relational Turbulence Model of Relationship Characteristics Associated With Experiences of Hurt in Romantic Relationships",2009,,Psychology,0,0,5255291
2855416,"Marija Dalbello",,NULL,45,296,1fac5afc008f83bd7d931266e2cb53ba7b7e7fac,"Immigrants being at home in libraries",2022,"Reading Home Cultures Through Books",,0,0,2855416
1836413,"Melissa Aronczyk",,NULL,69,1109,1fde526f8259096663c75c2b73adb87cf4f35a29,"The transnational promotional class and the circulation of value(s)",2013,,"Political Science",26,11,1836413
2468251,"Tawfiq Ammari",,NULL,30,1109,1ff1cab1a190b3b89220b347806e55243492ddad,"Self-declared Throwaway Accounts on Reddit: How Platform Affordances and Shared Norms enable Parenting Disclosure and Support",2019,"Proc. ACM Hum. Comput. Interact.","Computer Science",0,35,2468251
14634426,"Sarah Shugars",,NULL,25,196,2004efdac56043a80d2fe5b68608dcda22d0534a,"Winning on the Merits: The Joint Effects of Content and Style on Debate Outcomes",2017,"Transactions of the Association for Computational Linguistics","Computer Science",65,28,14634426
3026226,"Katherine Ognyanova",,NULL,138,1314,2009ba197cf31787bea6eefe2eade2465193463e,"The COVID States Project #62: COVID-19 vaccine attitudes among healthcare workers",2021,,,0,3,3026226
3459190,"C. Senteio",,NULL,43,340,200bdbc9b2b45d477df54e048c15d1c184ddcbc0,"Fulfilling information needs by classifying complex patron needs",2021,,Business,42,2,3459190
3026226,"Katherine Ognyanova",,NULL,138,1314,201ca0dfda2c8ce46c120b36df91037ae3e675d5,"A 50-state survey study of thoughts of suicide and social isolation among older adults in the United States.",2023,"Journal of Affective Disorders",Medicine,43,1,3026226
1699369,"Venkata Rama Kiran Garimella",,NULL,72,2680,206c685ff6ade486f1062d1cabecc2d322fecd3b,"Political Discourse on Social Media: Echo Chambers, Gatekeepers, and the Price of Bipartisanship",2018,"The Web Conference","Computer Science, Political Science",42,294,1699369
15910135,"Matthew D. Matsaganis",,NULL,45,512,2079cea1c527a849c766a84d2fc5d81ff07a086d,"4 Understanding Urban Foodways and Communicative Cities: A Taste of Hong Kong’s Yumcha Culture as Urban Communication",2013,,Sociology,0,2,15910135
1836413,"Melissa Aronczyk",,NULL,69,1109,209d9e2d1ec953e7387b3cce22693babda744ce4,"PR for the Public Interest",2021,"A Strategic Nature",,0,0,1836413
2519847,"Mark Aakhus","Rutgers University",https://comminfo.rutgers.edu/aakhus-mark,101,3475,20d5a1c25c49f88188a6153458175c65226294bf,"Introduction to the Second Scientific Meeting of the AIS Special Interest Group on Pragmatist IS Research",2010,,"Political Science",0,0,2519847
3247454,"M. Chayko",,NULL,20,399,20d712bfba1c252b0aaea51e9b291549ef1e6c85,"Female librarians and male computer programmers? Gender bias in occupational images on digital media platforms",2019,"J. Assoc. Inf. Sci. Technol.","Computer Science, Sociology",81,46,3247454
73315821,"Brenda L. Boyer",,NULL,44,29,20f696716addd7168028ffd7871da4ab07899b49,"K-12 online and blended learning, school libraries and school librarians",2014,,"Computer Science",37,2,73315821
3026226,"Katherine Ognyanova",,NULL,138,1314,2108b254ff21b1a16e0bed4aa5637026b0bb9d12,"State of the Nation: A 50-State COVID-19 Survey: Report #11: Perceptions of School Reopening Safety in the United States",2020,,"Political Science",0,0,3026226
144689908,"K. Greene",,NULL,153,5390,21102dfe71d0d6382afff83cf410ab51778d962b,"College students' cognitive rationalizations for tanning bed use: an exploratory study.",2012,"Archives of Dermatology",Medicine,6,23,144689908
2459268,"Dafna Lemish",,NULL,149,2723,2114b27810a4136e1350a1d68f2ba30d99aefa55,"Convention on Television Broadcasting for Children and Youth: a Case Study of Academic-Professional Collaboration in Israel",2009,,Geography,0,2,2459268
2898940,"Marya L. Doerfel",,NULL,43,1692,218a26ca0019bc5249c4cf8c1249ab8c385681b4,"Resilience in a complex and unpredictable world",2017,,Business,6,16,2898940
2519847,"Mark Aakhus","Rutgers University",https://comminfo.rutgers.edu/aakhus-mark,101,3475,219b2694c7e1aecc153f552b3e5d5e4fe8bfc7fc,"Commentary on “Objectivity in Newsmaking: an Argumentative Perspective”: Reflections on Argument in Practice",2016,,Philosophy,8,0,2519847
116307858,"Regina M. Marchi",,NULL,33,470,21baefc0570cf75ab44c35af9b73c37ac01e38ff,"Crossing Borders with the Santo Niño de Atocha (review)",2010,Americas,Sociology,0,0,116307858
5255291,"Jennifer A. Theiss",,NULL,95,2177,21cb4c64e6abd515e85d4646ee223a745e013ba4,"Characteristics of Communication in Families of Alcoholics",2016,,Psychology,49,11,5255291
84651025,"Ralph A. Gigliotti",,NULL,58,460,21e672562edbda6a84d294190a697780a126f931,"“Streams of Influence” in Student Affairs: A Renewed Emphasis on Leadership Education",2015,,Sociology,46,3,84651025
5255291,"Jennifer A. Theiss",,NULL,95,2177,220566c44d6df253f3e8a3715d9670403af15b40,"Relational Turbulence: What Doesn’t Kill Us Makes Us Stronger",2010,,Psychology,0,20,5255291
5947832,"Kristina M. Scharp",,NULL,75,1088,2224c1b9671f19d255c0bfdc1bab03036325e3a0,"Narrative coherence in online adoption stories told by adoptees, adoptive parents, and birth parents",2011,,Psychology,0,0,5947832
2824029,"N. Kranich",,NULL,47,305,223eab23991de74192a8a222caf4695db2df69a2,"A Study of an Online Catalog from a Public Services Perspective. Final Report.",1984,,"Computer Science",0,0,2824029
34881390,"S. Hull",,NULL,56,1009,2241fc7daafaf7bc72be7b7a547d5134ae84cc0d,"Using database linkages to monitor the continuum of care for hepatitis C virus among syringe exchange clients: Experience from a pilot intervention.",2017,"The International journal on drug policy",Medicine,12,11,34881390
144689908,"K. Greene",,NULL,153,5390,227d17a71d5f0d8f5688fd94cc3e4038bc401388,"“We Cannot Have any Negativity”: A secondary analysis of expectancies for the experience of emotion among women with gynecologic cancer",2020,"Journal of Health Psychology","Medicine, Psychology",40,1,144689908
3026226,"Katherine Ognyanova",,NULL,138,1314,2286554fcfe738b7de78327b7f05b40c1f5a5368,"The COVID States Project #34: Update on holiday gatherings in December 2020",2021,,,0,1,3026226
144689908,"K. Greene",,NULL,153,5390,2287cd144f9278303c0b222562297b623aa770c2,"Improving Prevention Curricula: Lessons Learned Through Formative Research on the Youth Message Development Curriculum",2016,"Journal of health communication","Psychology, Medicine",32,18,144689908
2519847,"Mark Aakhus","Rutgers University",https://comminfo.rutgers.edu/aakhus-mark,101,3475,22b57849a69f7f2fe741e1f71306009f593d1d95,"Perpetual Contact: Beginnings in the telephone",2002,,Psychology,0,26,2519847
2824029,"N. Kranich",,NULL,47,305,22be7d7c737da7c8b10b632bf3400317f6c9c500,"Civic Literacy: Reimagining a Role for Libraries",2023,"Library quarterly",,147,0,2824029
50981816,"Britt S. Paris",,NULL,37,215,22c402c5214e1a2aeae29d98f5665a6c698f8dcd,"Time Constructs: The Origins of a Future Internet",2018,,Sociology,125,2,50981816
1767245,"M. Radford",,NULL,86,1504,2317a680e8e02da1bc8ee94717804d6d4ed27d71,"Service Sea Change: Clicking with Screenagers through Virtual Reference",2007,,Engineering,13,11,1767245
144689908,"K. Greene",,NULL,153,5390,233a86b11536632208161bb964d13e1aedb43738,"Self-disclosure in Existing Relationships: Response and Relational Closeness",2008,,Psychology,0,2,144689908
1767245,"M. Radford",,NULL,86,1504,234294eb0d0fa6eb3131438accf27aac42f68e45,"Editorial board",2000,,,0,0,1767245
2604959,"L. Barkhuus",,NULL,109,3937,234a88185efbb348e8b3af9e70f95bf02968d4bb,"The television will be revolutionized: effects of PVRs and filesharing on television watching",2006,"International Conference on Human Factors in Computing Systems","Computer Science",20,66,2604959
13241733,"Galina B. Bolden",,NULL,56,2673,2351f8b2f79379dd18da1f3a5a6c543fb86c4014,"Negotiating Understanding in “Intercultural Moments” in Immigrant Family Interactions",2014,,Psychology,71,38,13241733
1453640467,"L. Pavlovsky",,NULL,7,28,2375cff5baeb1cc7fdcf8501bed4545d7fce0a91,"Determination of the Radiation Situation in the Areas of Unstable Structures Dismantling of the Shelter Object",2022,"Nuclear Power and the Environment",,0,0,1453640467
2459268,"Dafna Lemish",,NULL,149,2723,239d040cfab794fe83713d36e07e2fabc9faeed0,"“MAKE HER SKINNIER, MAKE HER CURVIER”: SEXUALISED GIRLHOOD IN JAPANESE CARTOONS",2012,,Art,0,1,2459268
3026226,"Katherine Ognyanova",,NULL,138,1314,23a6972e9ac22d14187e67ca277f2f134ec5e72a,"The COVID States Project #39: Public attitudes towards the storming of the Capitol building",2021,,,0,2,3026226
144689908,"K. Greene",,NULL,153,5390,23aeb0d1be1fcded5605a4c788bfba098a7a2cf1,"The Role of Engagement in Effective, Digital Prevention Interventions: the Function of Engagement in the REAL Media Substance Use Prevention Curriculum",2020,"Prevention Science","Psychology, Medicine",58,5,144689908
1836413,"Melissa Aronczyk",,NULL,69,1109,2406752ffa07b454f87ab2b6e67cfe2410460ba6,"Seeing Like a Publicist",2021,"A Strategic Nature",,0,0,1836413
1699369,"Venkata Rama Kiran Garimella",,NULL,72,2680,2419b65e6c8f2c85c711eaf236405e4722e24de8,"A Long-Term Analysis of Polarization on Twitter",2017,"International Conference on Web and Social Media","Computer Science, Sociology, Political Science",17,142,1699369
144689908,"K. Greene",,NULL,153,5390,24299d4a1cb75b904232d39589f6550da91fda10,"Cancer Communication and Partner Burden: An Exploratory Study",2014,,Psychology,59,36,144689908
2468251,"Tawfiq Ammari",,NULL,30,1109,24f750b998c10352ff3a83c6125b2c3ddd26cf19,"Networked Empowerment on Facebook among Parents of Children with Special Needs",2015,,,53,9,2468251
3026226,"Katherine Ognyanova",,NULL,138,1314,24f9097593a77e4f63a664d8d685d617643ff584,"The COVID States Project #19: Pandemic-related factors associated with candidate preferences",2021,,Geography,0,1,3026226
2604959,"L. Barkhuus",,NULL,109,3937,24fa637d007465b870713d80763964c59512862a,"Friendship Maintenance in the Digital Age: Applying a Relational Lens to Online Social Interaction",2015,"Conference on Computer Supported Cooperative Work","Computer Science, Psychology",48,22,2604959
116703389,"K. White",,NULL,13,43,24fc0c08ee1da2c78f4cb113ec122aa7324ed0fd,"#CommunicationSoWhite: Race and Power in the Academy and Beyond",2020,"Communication, Culture & Critique","Political Science",17,25,116703389
50981816,"Britt S. Paris",,NULL,37,215,2504f0ab5773a799abfbaef14eb2cb2d6a38a54b,"Naming Experience: Registering Resistance and Mobilizing Change with Qualitative Tools",2017,,Sociology,22,4,50981816
2459268,"Dafna Lemish",,NULL,149,2723,2554db1006336924b524154c9262263db0dc029b,"The Routledge International Handbook of Children, Adolescents, and Media",2022,,Medicine,0,0,2459268
34881390,"S. Hull",,NULL,56,1009,255d454dbfe3cfe81882aa54cc8f33d8f549abd8,"The Effects of Seeking and Scanning on Behavior",2007,,"Psychology, Medicine",0,2,34881390
2855416,"Marija Dalbello",,NULL,45,296,256249172dbdcee8e3871466dc2c50073111cab2,"iSchools and l-schools: Converging or diverging communities?",2012,"ASIS&T Annual Meeting","Political Science, Computer Science",12,8,2855416
116307858,"Regina M. Marchi",,NULL,33,470,2562fc0a6eff6d8dfdd0fce63926f9ea06c43dad,"METHODS APPENDIX",2018,"Crook County",,13,0,116307858
2855416,"Marija Dalbello",,NULL,45,296,2590ed3e20f35756a973c3b0e69c4618c304afcc,"The Text is a Text is a Text",2013,,"Political Science",0,0,2855416
7721216,"L. Mikesell",,NULL,54,834,259efbca270a9ff96ad4091a35ff904ea935ce27,"Length-of-stay review by diagnosis--a case study.",1975,"The Hospital medical staff",Medicine,0,0,7721216
13241733,"Galina B. Bolden",,NULL,56,2673,25a4d6af4a1c15b8e5a4b930da3655fb9df41c26,"Unpacking “Self”",2013,,Psychology,52,30,13241733
1795976,"J. Pavlik",,NULL,116,2654,2655f2e917c43fa380fbab740df57bed161a1d4b,"Communication perspectives on social networking and citizen journalism challenges to traditional newspapers",2011,,,37,5,1795976
1453640467,"L. Pavlovsky",,NULL,7,28,26756e1a153c1b8bf4deb923021bab07fbab4693,"Moving from assumptions to evidence: Assessing quality in online courses in a master of information program",2019,"ASIS&T Annual Meeting","Computer Science",5,0,1453640467
144689908,"K. Greene",,NULL,153,5390,26a0d7758613595e5b2757cd5e97dbd7fd33eabc,"The Theory of Active Involvement: Processes Underlying Interventions That Engage Adolescents in Message Planning and/or Production",2013,"Health Communication",Medicine,80,45,144689908
48264400,"Lauren A. Feldman",,NULL,66,3292,26ad0e4301d801cce6316fd0dd6c97d8ff9d7f4f,"Narratives shape cognitive representations of immigrants and policy preferences",2018,,,0,2,48264400
2468251,"Tawfiq Ammari",,NULL,30,1109,26dede804723c002041c4ba1eb9b66a01cd62308,"Voice Assistant Use in Long-Term Care",2023,"International Conference on Conversational User Interfaces","Computer Science",73,0,2468251
3247454,"M. Chayko",,NULL,20,399,2749c3b36b1002eab4da32ba7c8585fe36b7c48b,"Techno‐social Life: The Internet, Digital Technology, and Social Connectedness",2014,,Sociology,81,83,3247454
2898940,"Marya L. Doerfel",,NULL,43,1692,27837a0a19b2054ac5c73884b7c6c66b9502fd7e,"Networks, disrupted: Media use as an organizing mechanism for rebuilding",2015,"New Media & Society","Business, Computer Science",69,15,2898940
7721216,"L. Mikesell",,NULL,54,834,279d41a48a8d69d00cdd18e2cf1fd860ebb390d0,"“You Might Lose Him Through the Cracks”: Clinicians’ Views on Discharge from Assertive Community Treatment",2014,"Administration and Policy in Mental Health and Mental Health Services Research",Medicine,50,10,7721216
2969386,"A. Spoerri",,NULL,32,931,27a809f85344a1668f56eba4aa2849de42a7c926,"Souvenir: flexible note-taking tool to pinpoint and share media highlights",2002,"Annual International ACM SIGIR Conference on Research and Development in Information Retrieval","Computer Science",3,0,2969386
34881390,"S. Hull",,NULL,56,1009,2815e81a05960ddc810f63850704e47966985ea1,"Does misery love company? exploring the therapeutic effects of TV viewing on regretted experiences",2006,,Psychology,29,87,34881390
2459268,"Dafna Lemish",,NULL,149,2723,282d0ea8c882fe2f26a736938c8d051bdc286bfc,"“WASP WAISTS AND V-SHAPE TORSO” Measuring the Body of the “Global” Girland Boy in Animated Children’s Programs",2012,,Psychology,0,0,2459268
2459268,"Dafna Lemish",,NULL,149,2723,2831edf737d1e28365ee1163a35445a8b2300395,"Children and Media: A Global Perspective",2014,,Sociology,0,20,2459268
2519847,"Mark Aakhus","Rutgers University",https://comminfo.rutgers.edu/aakhus-mark,101,3475,283ebe1f91f09a6342a781b901611ab33eed6301,"Perpetual Contact: Mobile Communication, Private Talk, Public Performance",2002,,Engineering,0,1415,2519847
69362520,"J. R. Schement",,NULL,50,570,286dddc1209adab1ddc19f9e03c6e4e7cbb24ca6,"6. Data, Policy, and Democracy",2020,"Beyond Broadband Access",,0,0,69362520
2604959,"L. Barkhuus",,NULL,109,3937,28a10d4092fc044eec7bbca1467e774a9baf35fc,"User Profiles of Healthcare Professionals in a Chronic Obstructive Pulmonary Disease Care Pathway",2019,"International Conference on Pervasive Computing Technologies for Healthcare","Psychology, Computer Science",48,3,2604959
116307858,"Regina M. Marchi",,NULL,33,470,28c90dfe6b014200ab318d56b834df24026940ed,"Young People and the Future of News",2017,,"Political Science",0,0,116307858
2459268,"Dafna Lemish",,NULL,149,2723,28ce866f975551469ecf8eeffd697013a72ce5f5,"Studying Ethnic Minorities' Media Uses: Comparative Conceptual and Methodological Reflections",2012,,Sociology,28,20,2459268
1836413,"Melissa Aronczyk",,NULL,69,1109,28f86e5bf40119ab2eb31c52b3845b4845e53b2a,"Author Meets Critics: The Identity Trade: Selling Privacy and Reputation Online",2020,"Advertising & Society Quarterly",Business,0,19,1836413
144689908,"K. Greene",,NULL,153,5390,290bd0b182baedaeb37cac9dbe4c357f74129623,"Assessing Health Diagnosis Disclosure Decisions in Relationships: Testing the Disclosure Decision-Making Model",2012,"Health Communication","Psychology, Medicine",45,102,144689908
2604959,"L. Barkhuus",,NULL,109,3937,291699498596c2df4459e33c4770a457efa2a6cc,"Welcome Message from the UbiComp Adjunct Chairs",2014,"Ubiquitous Computing","Computer Science",0,0,2604959
3362498,"Shagun Jhaver",,NULL,38,1590,2917c86a0360d465ccc03f2d73b025a289eb66d5,"PostScholar: Surfacing Social Signals in Google Scholar Search",2016,"CSCW Companion","Computer Science",2,2,3362498
116307858,"Regina M. Marchi",,NULL,33,470,293257b3ec60ca2f7b005c0c839aff26ad3006a9,"U.S. Day of the Dead: Fusing Spanish, Indigenous and U.S. Cultures to Communicate New Messages",2011,,Art,56,1,116307858
2604959,"L. Barkhuus",,NULL,109,3937,293602e2b4fb7ab81c03e688375d01f2965a77c4,"Protecting Personal Health Data through Privacy Awareness",2022,"Proc. ACM Hum. Comput. Interact.","Computer Science",65,2,2604959
1836413,"Melissa Aronczyk",,NULL,69,1109,2956061b1e976e5b42f3c91d739f57c15cb36d10,"Place as Brand: Lessons from Two Canadian Cities",2007,,Business,17,0,1836413
2604959,"L. Barkhuus",,NULL,109,3937,295aa9d811b9648ab8ac2e93ff919b01354cb2c7,"HCI at the boundary of work and life",2016,"Personal and Ubiquitous Computing","Computer Science",28,8,2604959
84651025,"Ralph A. Gigliotti",,NULL,58,460,2995ca4e0bf8f45d1661780144636fbf14c6880b,"Theory and Practice in Doctoral Leadership Training",2015,,Psychology,0,0,84651025
3651083,"Itzhak Yanovitzky",,NULL,43,1734,29a78c122e7717ccaa516397d783b3ed5752e258,"Mass media, social control, and health behavior change: A longitudinal analysis of media effects on drunk -driving behavior, 1978--1995",2000,,Psychology,0,1,3651083
3026226,"Katherine Ognyanova",,NULL,138,1314,29d03dc36321af5f2256dad61dfe39fd8bafe8f0,"Association of Post–COVID-19 Condition Symptoms and Employment Status",2023,"JAMA Network Open",Medicine,8,18,3026226
3026226,"Katherine Ognyanova",,NULL,138,1314,29efa1a59d27de876a27aed0faf93b6e327f1e2d,"Community Mobility and Depressive Symptoms During the COVID-19 Pandemic in the United States",2023,"JAMA Network Open",Medicine,27,1,3026226
3362498,"Shagun Jhaver",,NULL,38,1590,29f0a5241b932f305e8fb401d1769bdc1fbfcfad,"Designing Word Filter Tools for Creator-led Comment Moderation",2022,"International Conference on Human Factors in Computing Systems","Computer Science",153,37,3362498
2459268,"Dafna Lemish",,NULL,149,2723,29f69c8875c77e524b2c5e37b135c9889d664bfe,"Gender in children’s television worldwide",2008,,Psychology,0,20,2459268
3026226,"Katherine Ognyanova",,NULL,138,1314,2a026b40c96acace7740010fc991d93d9aef6e61,"The COVID States Project #25: Public support for measures aimed at curbing COVID-19",2021,,,0,1,3026226
1699369,"Venkata Rama Kiran Garimella",,NULL,72,2680,2a03dfef45709f0dc6f35c4aae9eb6e01035fb28,"Scalable Facility Location for Massive Graphs on Pregel-like Systems",2015,"International Conference on Information and Knowledge Management","Computer Science",53,9,1699369
3362498,"Shagun Jhaver",,NULL,38,1590,2a0dc4f4e99b466e8844d9774436129ffca8ee97,"Bystanders of Online Moderation: Examining the Effects of Witnessing Post-Removal Explanations",2023,arXiv.org,"Computer Science",80,0,3362498
2898940,"Marya L. Doerfel",,NULL,43,1692,2a14de10c7c3d4d77eea60c4cee6ddf3b9572660,"Interorganizational Resilience: Networked Collaborations in Communities After Superstorm Sandy",2017,,Geography,0,7,2898940
2898940,"Marya L. Doerfel",,NULL,43,1692,2a319056a5ef3b6b2d7ab6c4a4b4a4292042c2f6,"Resilience organizing: a multilevel communication framework",2022,"Journal of Communications",,60,3,2898940
2519847,"Mark Aakhus","Rutgers University",https://comminfo.rutgers.edu/aakhus-mark,101,3475,2a3ea8db54293d9b3ba249cb9e0809948da7821b,"Perpetual Contact: Preface and acknowledgments",2002,,Sociology,0,0,2519847
5947832,"Kristina M. Scharp",,NULL,75,1088,2a51fd794a06af941a259cdc5b2353ea725d3982,"“Birth Mothers Are Not Bad People”: A Dialogic Analysis of Online Birth Mother Stories",2012,,Psychology,43,36,5947832
48264400,"Lauren A. Feldman",,NULL,66,3292,2a70519eee06e4b109b76aaa1659bf7ca6b6aad3,"The news about comedy",2007,,Sociology,58,65,48264400
116007957,"Dajung Woo",,NULL,28,208,2a9392e0bc3bf5f50138b628ca21e69197f956d9,"Gangs and Intergroup Communication",2017,,Psychology,0,0,116007957
5255291,"Jennifer A. Theiss",,NULL,95,2177,2ab2f0ee280483d8a792a071b2423efd7879a839,"Adopted Individuals’ Information Management Strategies for Managing Uncertainty about Genetic Family Health History",2022,"Journal of Family Communication",,45,1,5255291
4770278,"Y. Rivera",,NULL,29,252,2ab572f8b35b617602a5e26e51a90d032301a24e,"Making a picture worth a thousand numbers: recommendations for graphically displaying patient-reported outcomes data",2018,"Quality of Life Research","Medicine, Psychology",15,63,4770278
2459268,"Dafna Lemish",,NULL,149,2723,2aff16ab6e6afdc4f2bc5904d9e85e6641a89e95,"KakaoTalk and Facebook",2019,,,0,0,2459268
5255291,"Jennifer A. Theiss",,NULL,95,2177,2b28983a3d6da1d111578c36c4360035d8d32984,"Coping with Uncertainty in Close Relationships",2017,,Psychology,0,0,5255291
84651025,"Ralph A. Gigliotti",,NULL,58,460,2b4962a86a0445af59b4dbaeeb84e56ac1b2d242,"Communication: Sine Qua Non of Organizational Leadership Theory and Practice",2017,,Psychology,45,44,84651025
1767245,"M. Radford",,NULL,86,1504,2b4fe16241730bf8661da36ba4934856b9aa4ffd,"“COVID19 is_”: The Perpetuation of Coronavirus Conspiracy Theories via Google Autocomplete",2021,"ASIS&T Annual Meeting",Medicine,53,7,1767245
