author_id,name,affiliations,homepage,paper_count,citation_count,paper_id,title,year,venue,fields_of_study,reference_count,citation_count,author_id
15910135,"Matthew D. Matsaganis",,NULL,45,512,390aad2e79c5a19eeef232c4124896344f475608,"6 Auditing Communication Systems to Help Urban Policy Makers",2013,,Business,0,5,15910135
4770278,"Y. Rivera",,NULL,29,252,392f81707ea438dcec8c777a94aca00262fd7ff6,"“WHY WOULD SOMEONE INTENTIONALLY LIE?”: ASSESSING THE CREDIBILITY OF CANCER (MIS)INFORMATION ON FACEBOOK",2019,"AoIR Selected Papers of Internet Research",,17,0,4770278
34881390,"S. Hull",,NULL,56,1009,393e835162ab3941c67b16107e47b3349c5121e5,"An Analytic Method for Computer-Mediated Communication (CMC): Distinguishing the Message Expression and Reception Effects in Online Social Networks",2011,,"Computer Science",0,0,34881390
3026226,"Katherine Ognyanova",,NULL,138,1314,39456d2dc646a74a87e7ea27ceb589be079ea880,"Contagious Politics: Tie Strength and the Spread of Political Knowledge",2020,"Communication Research",Sociology,67,9,3026226
3459190,"C. Senteio",,NULL,43,340,39637f26ade5df0f7790b6656d1c9ad50bf9edda,"Integrating community-based participatory research and informatics approaches to improve the engagement and health of underserved populations",2015,"J. Am. Medical Informatics Assoc.","Medicine, Computer Science",83,151,3459190
3362498,"Shagun Jhaver",,NULL,38,1590,396447ddbf68e1989f571458de847d9a6ded2d01,"Getting Data for CSCW Research",2023,"CSCW Companion","Computer Science",0,0,3362498
15910135,"Matthew D. Matsaganis",,NULL,45,512,39738307de6fc8ea611110be50efe54488945040,"Stress in the Aftermath of the Economic Crisis in Urban Communities: The Interplay of Media Use, Perceived Economic Threat, and Community Belonging",2014,,Psychology,52,4,15910135
84651025,"Ralph A. Gigliotti",,NULL,58,460,397aefe403cc02e4beb89e4a888872f94ecdeb67,Communication,2017,,,0,19,84651025
2898940,"Marya L. Doerfel",,NULL,43,1692,397e145ebf4050112cbea4909afba4d8f4050b41,"(Un)Obtrusive Control in Emergent Networks: Examining Funding Agencies’ Control Over Nonprofit Networks",2017,,Business,65,18,2898940
2519847,"Mark Aakhus","Rutgers University",https://comminfo.rutgers.edu/aakhus-mark,101,3475,3988679bf9d823637db5add7ff71d7a207fad01d,"Activity, materiality, and creative struggle in the communicative constitution of organizing: Two cases of communication design practice",2012,,Sociology,21,14,2519847
2824029,"N. Kranich",,NULL,47,305,398cccbf386d641957fe76b5bfb98afd0d4eab65,"Deliberative Dialogue: Changing the CD Discourse",2012,,"Political Science",0,0,2824029
52100469,"J. Valenza",,NULL,62,88,39a398cc4720cbf6c5edd5235c375090df9ceb94,"Power tools : forms and presentations",1998,,Engineering,0,0,52100469
3459190,"C. Senteio",,NULL,43,340,39e640352b349ce28d3a428b5521fd53fff307d7,"Consumer Health Informatics Research: A Scoping Review of Informatics, Information Science and Engineering Literature (Preprint)",2020,,,307,0,3459190
116007957,"Dajung Woo",,NULL,28,208,39f119027bc2c6328854a7da02ce6f978faa932a,"Reconceptualizing interorganizational collaborations as tensile structures: Implications of conveners’ proactive tension management",2018,"Communication monographs","Political Science",42,17,116007957
52100469,"J. Valenza",,NULL,62,88,3a0501ae9fe52be9c50d21198a79a40b9f1487ba,"LibGuides: High School: Crash Course Research Tips and Resources",2020,,Psychology,0,0,52100469
14634426,"Sarah Shugars",,NULL,25,196,3a09454c68b7b5b0626455a47b5eeebe72f93483,"Categorizing the non-categorical: the challenges of studying gendered phenomena online",2023,"Journal of Computer and Communications",,42,0,14634426
1795976,"J. Pavlik",,NULL,116,2654,3a1a31feda9047fee3a8fe0aeff45738a3e13a42,"Introduction: Understanding the Impact of New Media on Journalism",2001,,Sociology,0,2,1795976
47084399,"K. Costello",,NULL,31,583,3a36bc00c511288c20b3119c4cb9d87c71c001c9,"Methods for a feminist technoscience of information practice: Design justice and speculative futurities",2021,"J. Assoc. Inf. Sci. Technol.","Computer Science",69,8,47084399
7721216,"L. Mikesell",,NULL,54,834,3a3d8e7d1c6590fbecd1692646af1aec2108e23d,"Exploring the Heterogeneity of ‘Schizophrenic Speech’",2016,,Psychology,27,5,7721216
7721216,"L. Mikesell",,NULL,54,834,3a6761275a749a05983b688462364d4641023b9d,"Recent Innovations in Primary Care Cancer Survivorship Care Delivery",2023,"Cancer Research",,0,0,7721216
1767245,"M. Radford",,NULL,86,1504,3a9b64ac18cdf71229ac28a3567050ad22fddae3,"“I’ve Already Googled It, and I Can’t Understand It”: User’s Perceptions of Virtual Reference and Social Question-Answering Sites",2021,"Reference and user services quarterly",,0,2,1767245
5255291,"Jennifer A. Theiss",,NULL,95,2177,3a9ce923a047fcf26f181d64dbdd6dbf805d166f,"Communication and the Emotional, Cognitive, and Relational Consequences of First Sexual Encounters between Partners",2007,,Psychology,63,22,5255291
144689908,"K. Greene",,NULL,153,5390,3aa5c95639050db663f9998f959c93b5f3750352,"2 0 20 M ay 2 00 8 Adolescents ’ Responses to Peer Smoking Offers : The Role of Sensation Seeking and Self-esteem",2008,,,71,0,144689908
3651083,"Itzhak Yanovitzky",,NULL,43,1734,3aba189ebead56985c91497158e143a2026bb988,"TRADITIONAL, ONLINE, OR HYBRID CLASSROOM? RESULTS FROM A NATURAL EXPERIMENT",2017,,Engineering,0,0,3651083
1699369,"Venkata Rama Kiran Garimella",,NULL,72,2680,3ad9c86d034cb21343b33807f1aa788784585307,"Can WhatsApp Counter Misinformation by Limiting Message Forwarding?",2019,"International Workshop on Complex Networks & Their Applications","Computer Science",21,52,1699369
1699369,"Venkata Rama Kiran Garimella",,NULL,72,2680,3b523c12b43b0b42137aee19128bb296d4d144c5,"Addressing Challenges and Opportunities in Online Extremism Research: An Interdisciplinary Perspective",2021,"CSCW Companion","Computer Science",32,2,1699369
1795976,"J. Pavlik",,NULL,116,2654,3b580ca76aa62fe24120ab9b09a80cf8dbea5b01,"Increasing Public Understanding of Heart Disease: An Analysis of Data From the Minnesota Heart Health Program",1993,,Medicine,27,23,1795976
144689908,"K. Greene",,NULL,153,5390,3b884e4acac1f909488f81301a7a9d9d6c2c697b,"Exploring indicators of engagement in online learning as applied to adolescent health prevention: a pilot study of REAL media",2020,"Educational technology research and development","Psychology, Medicine",80,11,144689908
69362520,"J. R. Schement",,NULL,50,570,3b8f595e43ca186e147c89ca008bf70beaf8eb59,"Communication and Information",2017,,"Computer Science",1,4,69362520
3247454,"M. Chayko",,NULL,20,399,3ba7b7fb45a4b97e9b0e228ac2ceba396e80cb6d,"How you “act your age” when you watch TV",1993,,Sociology,54,7,3247454
5947832,"Kristina M. Scharp",,NULL,75,1088,3bce741d93215ec13d42a367bc19e5f60e35ada8,"“I hate all the children, especially mine”: Applying relational dialectics theory to examine the experiences of formerly childfree regretful parents",2023,"Journal of Social and Personal Relationships",,57,0,5947832
52100469,"J. Valenza",,NULL,62,88,3bf71c5e07e2897f91c45813394187a512b76e57,"Electronic Reference Roundup: A Game of Tetris.",1998,,"Computer Science",0,0,52100469
1795976,"J. Pavlik",,NULL,116,2654,3c13142ee08cf654d78b7253a8055303a8a75a60,"Demystifying Media Technology",1993,,"Political Science",0,6,1795976
69362520,"J. R. Schement",,NULL,50,570,3c33ebe2768a0e2aeb4c6478b9ebee15138fe839,"The New Industrial Society",1998,,Engineering,0,29,69362520
4770278,"Y. Rivera",,NULL,29,252,3c504cf06522906eb9bda891ac8dd9d3ffe9e93e,"Contextualizing Engagement With Health Information on Facebook: Using the Social Media Content and Context Elicitation Method",2020,"Journal of Medical Internet Research",Medicine,63,4,4770278
5255291,"Jennifer A. Theiss",,NULL,95,2177,3c5c1dfdeb43961e4eaaa971b4cec54240fd54c8,"An Analysis of Turn Transitions and Conversational Motifs in Parent-Adolescent Emotion-Focused Interactions",2023,"Communication Methods and Measures",,65,1,5255291
2824029,"N. Kranich",,NULL,47,305,3c690d2a4fd21fa0661e0d0e6ef1a1b7c90c8d65,"Le USA Patriot Act: consequences sur la liberte d'expression",2004,,"Political Science",0,0,2824029
144689908,"K. Greene",,NULL,153,5390,3c69b12552cf7b0881232af5292b6fc777645bf7,"‘95% less harmful’? Exploring reactions to quantitative modified risk claims for snus and e-cigarettes",2021,"Tobacco Control",Medicine,51,6,144689908
116007957,"Dajung Woo",,NULL,28,208,3c83dfa7f9bc125f7d7b4a2db85ea3818a71fef6,"Organizational Exit in Interorganizational Collaboration: From a Negotiated Cyclical Process View",2019,"Academy of Management Proceedings",Business,0,0,116007957
84651025,"Ralph A. Gigliotti",,NULL,58,460,3ce8268e350dac035af369c8f082e424ca3369ce,"Institutional Identification and Sense of Community: Analysis of a New Online Graduate Public Administration Program",2016,,"Political Science",54,7,84651025
2898940,"Marya L. Doerfel",,NULL,43,1692,3cfee44a1b580611ae78e88457e3dcaa756e14f6,"Structuring Organizational Communication: Employees' Role and Network Position as Predictive of Institutional Talk About the Adoption of Technology",2012,"Hawaii International Conference on System Sciences","Computer Science, Business",44,2,2898940
7495433,"Lea P. Stewart",,NULL,45,1097,3d068c2cfe380f3ebf7f5212773ed7afb0cd5a57,"The Marble Company: a Simulation Game for Organizational Communication and Information Management",1989,,"Computer Science",11,1,7495433
5947832,"Kristina M. Scharp",,NULL,75,1088,3d2a991a921e37e359e66d1b0f7b0b79cf22239b,"“I Want to Go Home”",2016,,Psychology,64,26,5947832
1795976,"J. Pavlik",,NULL,116,2654,3d608e71e366c3142b6748341931f8e3642c1f45,"Advancing Engaged Scholarship in the Media Field",2019,"Media and Communication","Political Science",4,7,1795976
144689908,"K. Greene",,NULL,153,5390,3d8190ac45b012dbedc2025dde0e7b3e4092af23,"Model of Disclosure Effect: General and Health-Related Disclosure in Existing Relationships",2010,,Business,0,2,144689908
52100469,"J. Valenza",,NULL,62,88,3d89a7402aad5b305c26a054a6e20ef890199c82,"School libraries meet the tornadoes: the transformational impact of school reform and the Web",1999,,"Political Science",0,1,52100469
3247454,"M. Chayko",,NULL,20,399,3de2fd6b4ce10ecd5e3159af9e24c93492946823,"Portable Communities: The Social Dynamics of Online and Mobile Connectedness",2008,,"Computer Science",0,9,3247454
1836413,"Melissa Aronczyk",,NULL,69,1109,3df48691f40be7f1e79e6da4c15caa2a7ce2fba8,"Reading the comments: Likers, haters, and manipulators at the bottom of the web",2016,"New Media & Society","Computer Science",4,50,1836413
5255291,"Jennifer A. Theiss",,NULL,95,2177,3e2bc21f22489053af80fb015891254126fe781f,"Relational turbulence during the COVID-19 pandemic: A longitudinal analysis of the reciprocal effects between relationship characteristics and outcomes of relational turbulence",2021,"Journal of Social and Personal Relationships",Medicine,53,12,5255291
52100469,"J. Valenza",,NULL,62,88,3e4fe28a6bef12d0da91f792fa9d084a07f1c99e,"Reboot Camp: Get into Tech Shape.",2008,,Engineering,0,2,52100469
1699369,"Venkata Rama Kiran Garimella",,NULL,72,2680,3e637dd58ad17a38129b1267b3a9b6bea30e20ee,"Inferring international and internal migration patterns from Twitter data",2014,"The Web Conference","Computer Science",25,187,1699369
3651083,"Itzhak Yanovitzky",,NULL,43,1734,3e7096e3f89d276648ed2782c5d9431d5b8fd8b6,"Mass Media, Social Norms, and Health Promotion Efforts",2001,"Communication Research","Psychology, Computer Science",119,197,3651083
48264400,"Lauren A. Feldman",,NULL,66,3292,3e73ea3ba87e93f033939fc8401f0a9e1a3d8313,"Narratives Shape Cognitive Representations of Immigrants and Immigration-Policy Preferences",2021,"Psychology Science",Medicine,48,14,48264400
2824029,"N. Kranich",,NULL,47,305,3e81209dd7009435d82bee32939a671f702d78c4,"Promoting Adult Learning through Civil Discourse in the Public Library.",2010,,Sociology,50,11,2824029
47084399,"K. Costello",,NULL,31,583,3eed23888a19cd85b1bfc7b218e651262b34c0fa,"Information quality, privacy policies, and data safety practices in online social networks for health: A longitudinal analysis",2015,"ASIS&T Annual Meeting","Business, Computer Science",21,1,47084399
144689908,"K. Greene",,NULL,153,5390,3f2bd8333d6e384b7fcd26b25c789532966c5cbf,"Framing and dosage effects: use of protection motivation theory to examine efficacy of anti-cocaine visual messages",2012,,Medicine,59,2,144689908
2459268,"Dafna Lemish",,NULL,149,2723,3f2ead77200a9cf42beca89bd47fa2cfb685f9b1,"The Silenced Majority: Women in Israel’s 1988 Television Election Campaign",2018,,"Political Science",1,1,2459268
7495433,"Lea P. Stewart",,NULL,45,1097,3f411d828744273a1a9cccaa4c877a786b621030,"Language Skills in the Classroom. What Research Says to the Teacher.",1982,,"Computer Science",0,7,7495433
144689908,"K. Greene",,NULL,153,5390,3f45959649d30fbbf29527f2f8a7d06c7d48d902,"stimulant medications for illicit use College students' use of compliance-gaining strategies to obtain prescription",2010,,Medicine,25,0,144689908
3026226,"Katherine Ognyanova",,NULL,138,1314,3f7e4779c63e5afa0b452969e5306f033e854ef6,"The COVID States Project #17: COVID-19 test result times",2021,,,0,8,3026226
5255291,"Jennifer A. Theiss",,NULL,95,2177,40018dc5da881fbbd642114eb92912aba4e877df,"The Effects of Uncertainty in Close Relationships",2017,,Mathematics,0,0,5255291
69362520,"J. R. Schement",,NULL,50,570,4001c722f95dd09395ac145bf50897270ec687f4,"A 21st-Century Strategy for Librarians.",1996,,Engineering,0,10,69362520
3026226,"Katherine Ognyanova",,NULL,138,1314,4003213ec31eac2104ce6c06a93102cfba6e871a,"Misinformation, Trust, and Use of Ivermectin and Hydroxychloroquine for COVID-19",2023,"JAMA Health Forum",Medicine,27,2,3026226
116007957,"Dajung Woo",,NULL,28,208,402886e0641cc5d4ff2bd16f7b0c80ceb58f0b77,"Social Media Policies: Implications for Contemporary Notions of Corporate Social Responsibility",2015,"Journal of Business Ethics",,96,0,116007957
1795976,"J. Pavlik",,NULL,116,2654,4043474d7169aa238ea0b440b6d6be5e843545c9,"Drones, Augmented Reality and Virtual Reality Journalism: Mapping Their Role in Immersive News Content",2020,,"Computer Science",83,18,1795976
2519847,"Mark Aakhus","Rutgers University",https://comminfo.rutgers.edu/aakhus-mark,101,3475,406f7651df616a98422a9a7d5a1b3d5aed0077f0,"Argumentation in Complex Communication: Managing Disagreement in a Polylogue Cambridge University Press, 263 pp",2023,"Argumentation: an international journal on reasoning",,5,1,2519847
3459190,"C. Senteio",,NULL,43,340,4070eee008507f3d97d5928a2947878eb98e0918,"The Impact of Being a Peer Sexual Health Educator: Lessons Learned from Mobilizing African American Adolescents Against HIV in Flint, Michigan",2018,"American Journal of Sexuality Education",Psychology,50,5,3459190
116307858,"Regina M. Marchi",,NULL,33,470,407f1bfead41577c9d1091ec60d76154d54de162,"Hybridity and Authenticity in US Day of the Dead Celebrations",2013,,Sociology,77,11,116307858
73315821,"Brenda L. Boyer",,NULL,44,29,40870731fcd4745177e627c7cf75c95c0b68ee9c,"LibGuides. KAHS Subject Guides. Berks Reading Olympics 2015.",2012,,Sociology,0,0,73315821
1699369,"Venkata Rama Kiran Garimella",,NULL,72,2680,4089fbb617a9a0a1032625876c6dba76ff8c185d,"Polarization on Social Media",2018,,"Computer Science",0,17,1699369
13241733,"Galina B. Bolden",,NULL,56,2673,40b343d16d53c93e2965b6251761e20d58fd9c20,"Preference organization of sequence-initiating actions: The case of explicit account solicitations",2010,,Psychology,95,68,13241733
144689908,"K. Greene",,NULL,153,5390,40b705190984a0b915f0353d372933b26d652323,"The Role of Response Perceptions in Couples’ Ongoing Cancer-Related Disclosure",2019,"Health Communication","Medicine, Psychology",52,7,144689908
3362498,"Shagun Jhaver",,NULL,38,1590,40e43b8051dbdd3a22b2176a455a1a957fbd2c85,"The view from the other side: The border between controversial speech and harassment on Kotaku in Action",2017,"First Monday","Sociology, Computer Science",68,44,3362498
2519847,"Mark Aakhus","Rutgers University",https://comminfo.rutgers.edu/aakhus-mark,101,3475,40eb5ee97d258b0cd8f4e87ed5d7dc0c3c75de36,"Examining Argumentation in Context",2009,,,0,7,2519847
5947832,"Kristina M. Scharp",,NULL,75,1088,40f8fb9524c57ccfcad150cbe8c44fc486e72bdf,"Disrupting the humanities and social science binary: framing communication studies as a transformative discipline",2019,"Review of Communication",Sociology,40,27,5947832
2824029,"N. Kranich",,NULL,47,305,41073b76096f01bb870d43b829b6d58f3dc2b1fe,"The Civic Mission of School Libraries",2006,,Sociology,37,9,2824029
3362498,"Shagun Jhaver",,NULL,38,1590,4118b20b39414b8548aa8c4e94d674734391b1cc,"Measuring Professional Skill Development in U.S. Cities Using Internet Search Queries",2019,"International Conference on Web and Social Media","Computer Science, Business",52,9,3362498
2604959,"L. Barkhuus",,NULL,109,3937,416914e76af91e1ac0b27bc986c6700a17532c6c,"Empowerment through seamfulness: smart phones in everyday life",2011,"Personal and Ubiquitous Computing","Computer Science",44,168,2604959
1699369,"Venkata Rama Kiran Garimella",,NULL,72,2680,416cef8ee1e032f069bf4912944e57c1478bf949,"Giving is caring: understanding donation behavior through email",2014,"Conference on Computer Supported Cooperative Work","Computer Science, Sociology",51,21,1699369
14634426,"Sarah Shugars",,NULL,25,196,416fcdedbbb6960ce55bfb89cc573f5975beb3d2,"One outstanding path from A to B",2021,"Nature Physics",,3,0,14634426
144689908,"K. Greene",,NULL,153,5390,417c4036c4022286f08dfca6ffd5f9b04f3f7ca4,"Communication Efficacy and Couples' Cancer Management: Applying a Dyadic Appraisal Model",2015,"Communication monographs","Psychology, Medicine",88,36,144689908
7495433,"Lea P. Stewart",,NULL,45,1097,41af784131481740bf51fdc54a609c87976e4d77,"Relationship with instructor and other variables influencing student evaluations of instruction",1982,,Psychology,22,54,7495433
2459268,"Dafna Lemish",,NULL,149,2723,41cec29eca0dc98a0b0fcfa124aff0674a1f263b,"The next time is now! How children and media professionals must respond to Russia’s war in Ukraine",2022,"Journal of Children and Media",,10,3,2459268
15910135,"Matthew D. Matsaganis",,NULL,45,512,41d6ac1256a3a45c6a363cf5876ecd51320b00b3,"8 Chinese Tourists, Themed Casinos, and Consumer Pedagogy in Macao",2013,,Business,0,0,15910135
48264400,"Lauren A. Feldman",,NULL,66,3292,420171fe97a1a5f060c58fd578904778c02b5a55,"Is There Any Hope? How Climate Change News Imagery and Text Influence Audience Emotions and Support for Climate Mitigation Policies",2018,"Risk Analysis","Psychology, Medicine",78,120,48264400
1795976,"J. Pavlik",,NULL,116,2654,420fe8b736bc4a7847de6567e1cc2f9a1c61c696,"Fueling a Third Paradigm of Education: The Pedagogical Implications of Digital, Social and Mobile Media",2015,,"Computer Science",37,35,1795976
2459268,"Dafna Lemish",,NULL,149,2723,42130795b5334de1828f5ae421e6e6934fcb5537,"Television as a “Safe Space” for Children: The Views of Producers around the World",2009,,Geography,0,1,2459268
2969386,"A. Spoerri",,NULL,32,931,4217bfbf06df9ee513c960e5c6ac7153ab00cc7b,"Information visualization: the next frontier",1994,"International Conference on Computer Graphics and Interactive Techniques","Computer Science",3,11,2969386
144147439,"Suchinthi Fernando",,NULL,7,25,421d7957783d216fb8616b3c97b9cc1ca1e2efc9,"Human-Related Problems in Information Security in Russian Cross-Cultural Environments",2011,,Geography,0,4,144147439
48264400,"Lauren A. Feldman",,NULL,66,3292,42560bf73f408f1ba0aefb8819da3dd27a0a79ae,"Cloudy with a Chance of Heat Balls: The Portrayal of Global Warming on The Daily Show and The Colbert Report",2013,,"Geography, Sociology",45,41,48264400
5947832,"Kristina M. Scharp",,NULL,75,1088,427c2c60ea9d22e94851c135719c85cdb58f2356,"The Relationship Between Students' Family Communication, Transition Efficacy, and Communication Skill",2019,"Journal of College Orientation, Transition, and Retention",Psychology,45,3,5947832
1795976,"J. Pavlik",,NULL,116,2654,428d75e1d66fc3a1fdfbf0145776c9bdc8760333,"Unified approach to graphs and metric spaces",2017,,Mathematics,33,2,1795976
5947832,"Kristina M. Scharp",,NULL,75,1088,42980229501951b1441ff15ecb10472997327250,"Stories of Postpartum Depression: Exploring Health Constructs and Help-Seeking in Mothers’ Talk",2014,"Women & health","Psychology, Medicine",21,40,5947832
144689908,"K. Greene",,NULL,153,5390,42cf20e972091690adcdb1f398e8d4ec32f09d7b,"Who Watches Verbally Aggressive Shows ? An Examination of Personality and Other Individual Difference Factors in Predicting Viewership",2009,,,80,14,144689908
5947832,"Kristina M. Scharp",,NULL,75,1088,42d373b5f48ee7e2a9155e464f06ad79f05d6779,"“There’s Always Going to Be Uncertainty”: Exploring Undergraduate Student Parents’ Sources of Uncertainty and Related Management Practices",2020,,Sociology,61,8,5947832
7721216,"L. Mikesell",,NULL,54,834,42df60138fb368213b8029583315e2032e93b629,"Conversational Practices of a Frontotemporal Dementia Patient and His Interlocutors",2009,,Psychology,36,41,7721216
2855416,"Marija Dalbello",,NULL,45,296,43126e8005ee4ae4b3bf40fb908572b91a6b03e4,"Writing home cultures through books at the time of the pandemic",2022,"Reading Home Cultures Through Books",,0,0,2855416
2519847,"Mark Aakhus","Rutgers University",https://comminfo.rutgers.edu/aakhus-mark,101,3475,4313f1718d0c46c98c2cd2f8caa36c3a468accbc,"The Communicative Work of Organizations in Shaping Argumentative Realities",2016,"Philosophy & Technology",Sociology,65,7,2519847
84651025,"Ralph A. Gigliotti",,NULL,58,460,433dcf5a275205adff2156355760b7dc22ea28a8,"Chair Perspectives on Leading through Prolonged and Intersecting Crises",2021,"The Department Chair",,1,0,84651025
7721216,"L. Mikesell",,NULL,54,834,43676c78b0254bf48b24f07be61332d63be0e825,"Affordances of mHealth technology and the structuring of clinic communication",2018,,Psychology,60,2,7721216
3651083,"Itzhak Yanovitzky",,NULL,43,1734,43cc1e8878b5623e3579f314bf10a8b1e2dfdd39,"Using Theory to Design Evaluations of Communication Campaigns: The Case of the National Youth Anti-Drug Media Campaign.",2003,"Communication theory : CT : a journal of the International Communication Association","Psychology, Medicine",40,233,3651083
2459268,"Dafna Lemish",,NULL,149,2723,43d2fc6e146e8794c8378044b880ac78f0bce75d,"Academic Immigrants in DEI Discussions: Another Blind Spot",2022,"Change: The magazine of higher learning",,0,1,2459268
3362498,"Shagun Jhaver",,NULL,38,1590,43de11ef1ac04b3597a0a70011fd63ca3a05a972,"Deplatforming Norm-Violating Influencers on Social Media Reduces Overall Online Attention Toward Them",2024,arXiv.org,"Computer Science",79,0,3362498
1699369,"Venkata Rama Kiran Garimella",,NULL,72,2680,43e116ea07750ff2e5ccb3dd53db58dd6efff081,"Social Media Image Analysis for Public Health",2015,"International Conference on Human Factors in Computing Systems","Psychology, Computer Science",29,78,1699369
1795976,"J. Pavlik",,NULL,116,2654,43e1d8dd252297d4c369a7fb47ffa9edcf24ebcc,"Experiential Media and Disabilities in Education: Enabling Learning through Immersive, Interactive, and Customizable Digital Platforms",2017,,"Computer Science",0,3,1795976
3459190,"C. Senteio",,NULL,43,340,43e59e9ca59e3bc5c05b083cbd4c8644d521af4e,"Trying to Make Things Right",2014,"Qualitative Health Research",Medicine,62,20,3459190
1767245,"M. Radford",,NULL,86,1504,43e956d006d373c56cd7d3ae2065dd356686a734,"Behaviors and preferences of digital natives: Informing a research agenda",2008,"ASIS&T Annual Meeting","Sociology, Computer Science",23,12,1767245
84651025,"Ralph A. Gigliotti",,NULL,58,460,4403f17cb6a764b88a73237a18508212b9d77ff0,"The Decision to Lead; the Choice to Follow",2019,"Leadership, Communication, and Social Influence",Psychology,0,0,84651025
7721216,"L. Mikesell",,NULL,54,834,444684eaee2ef3f15fbb9ae503c5e2aea7e893c9,"Clinical Factors Associated with Successful Discharge from Assertive Community Treatment",2017,"Community mental health journal",Medicine,24,9,7721216
2468251,"Tawfiq Ammari",,NULL,30,1109,444dd40629498fcfbd7686dedd31c2382834f900,"Understanding and Supporting Fathers and Fatherhood on Social Media Sites",2015,"International Conference on Human Factors in Computing Systems","Computer Science, Psychology",50,126,2468251
2459268,"Dafna Lemish",,NULL,149,2723,448fc5c4b43225e6543042a3fe20987c185b294b,"RESULTS OF AN ANALYSIS OF CHILDREN’S TV IN 8 COUNTRIES",2018,,,2,2,2459268
1767245,"M. Radford",,NULL,86,1504,44b65b93d286624f71946a1e4867fb278935cc9d,"Conceptualizing collaboration and community in virtual reference and social question and answer services",2013,"Information Research","Computer Science",0,5,1767245
2519847,"Mark Aakhus","Rutgers University",https://comminfo.rutgers.edu/aakhus-mark,101,3475,44f7d73a704f99145d5976bf4a4a5afe3801e0e3,"Argumentative Polylogues in a Dialectical Framework: A Methodological Inquiry",2014,,Sociology,61,67,2519847
50981816,"Britt S. Paris",,NULL,37,215,45b0c47b372bb8ab36dbac4842187b2490321c99,"Getting Ourselves Together: Data-centered participatory design research & epistemic burden",2021,"International Conference on Human Factors in Computing Systems","Computer Science",52,39,50981816
7495433,"Lea P. Stewart",,NULL,45,1097,45bafdcfa1fa0732f913e2e2804a39f1cfb3e484,"THE ETHNOGRAPHY OF A WHISTLE BLOWING INCIDENT: IMPLICATIONS FOR ORGANIZATIONAL COMMUNICATION",1979,,"Political Science",0,2,7495433
47084399,"K. Costello",,NULL,31,583,45cccad7626c05c23cb028555309eacaffae4640,"The Information Practices of Parents of Transgender and Non-Binary Youth: An Exploratory Study",2022,"Library Trends","Computer Science",79,5,47084399
69525068,"Brian J. Householder",,NULL,7,314,45fe0fd36e9337113b28ca265e85947ee3d357a5,"The Theory of Reasoned Action",2002,,Psychology,0,305,69525068
