author_id,name,affiliations,homepage,paper_count,citation_count,paper_id,title,year,venue,fields_of_study,reference_count,citation_count,author_id
5947832,"Kristina M. Scharp",,NULL,75,1088,0034255ba3d49569c87ad37286b164a7faba902a,"What is a theme? Teaching thematic analysis in qualitative communication research methods",2018,"Communication Teacher",Psychology,12,84,5947832
15910135,"Matthew D. Matsaganis",,NULL,45,512,00a6657a036e91ba4643e0cb7afe6e53d704b554,"Negotiating Peace-Building Through Networks: The Role of Middle-Level Officials in the Cases of Northern Ireland and Colombia",2006,,"Political Science",0,0,15910135
3026226,"Katherine Ognyanova",,NULL,138,1314,00a82374fdb108de8572a3f4f9e6f56c9fd2f688,"Digital inequality, faculty communication, and remote learning experiences during the COVID-19 pandemic: A survey of U.S. undergraduates.",2021,"PLoS ONE",Medicine,22,84,3026226
5255291,"Jennifer A. Theiss",,NULL,95,2177,00e7bebc922179ca92c473ba58280003f4b38e7f,"Ad-Hoc Reviewers from 2018",2018,"Journal of nonverbal behavior",,0,0,5255291
7495433,"Lea P. Stewart",,NULL,45,1097,0103f7256a4cbcc347984b04a24ec4097037345d,"The Extent and Effects of the Sexual Harassment of Working Women",1984,,Psychology,9,125,7495433
4770278,"Y. Rivera",,NULL,29,252,010d861cda5cf9cd6f8f33a96ad9cc916fa31ea4,"When Engagement Leads to Action: Understanding the Impact of Cancer (Mis)information among Latino/a Facebook Users",2021,"Health Communication",Medicine,89,4,4770278
3026226,"Katherine Ognyanova",,NULL,138,1314,010e806ee1d5d06ee5c1e26ef0f381fcf5630125,"The COVID States Project #48: Assessing the impact of the pause in Johnson & Johnson vaccine use on COVID-19 vaccination intent",2021,,,0,1,3026226
3026226,"Katherine Ognyanova",,NULL,138,1314,011d29e25afb5697c00ab3645c77e435e75d38c9,"The COVID States Project #81: Child vaccination rates",2022,,,0,2,3026226
5255291,"Jennifer A. Theiss",,NULL,95,2177,01204140485aa1e3b3bb62cae6d9a854d48c0720,"Interpersonal Communication: Putting Theory into Practice",2013,,Psychology,0,40,5255291
1699369,"Venkata Rama Kiran Garimella",,NULL,72,2680,0140894e3773a20462f304afc5cea79c059675f7,"Urban Dictionary Embeddings for Slang NLP Applications",2020,"International Conference on Language Resources and Evaluation","Computer Science",47,24,1699369
3026226,"Katherine Ognyanova",,NULL,138,1314,014fb1617e7918cdbcc13addd8f1abd9bfb9132d,"COVID States Project: A 50-State COVID-19 Survey Report #26: Trajectory of COVID-19-Related Behaviors",2020,,Psychology,0,4,3026226
4770278,"Y. Rivera",,NULL,29,252,0160b06034658cb0ec24911c92bf8ec8341748b6,"Exploring the Reasons and Ways Puerto Rican College Students Search for Safer Sex Information",2013,,Psychology,35,1,4770278
14634426,"Sarah Shugars",,NULL,25,196,01c0ee2a9194cf38bee56934d90ce2bfee122f5e,"Games for Civic Renewal",2018,,Sociology,0,1,14634426
1767245,"M. Radford",,NULL,86,1504,01ed078b1b849c8e3fbc7cd892c4bb53ced1c931,"The Myth and the Reality of the Evolving Patron",2013,,Sociology,5,1,1767245
2459268,"Dafna Lemish",,NULL,149,2723,020ac3c724be5095e9329addf7aab04ee0629fdf,"Perpetuating Gender Stereotypes from Birth: Analysis of TV Programs for Viewers in Diapers",2019,"The Palgrave Handbook of Children's Film and Television",Psychology,26,1,2459268
1795976,"J. Pavlik",,NULL,116,2654,020c0c5e0a39d99ca6a79f07b45e758ac1d7ed13,"Kant's Idea of Eternal Peace and the European Union",2004,,Economics,0,0,1795976
121149959,"Goun-ho Kim",,NULL,11,8,02276fad8497f7b48c60137a11dc8437aa459cb4,"Public preferences for corporate social responsibility activities in the pharmaceutical industry: Empirical evidence from Korea",2019,"PLoS ONE","Medicine, Psychology",32,8,121149959
2459268,"Dafna Lemish",,NULL,149,2723,022edf7ff71e6780d4f7acb882e03fb371dfce4f,"Audience Effects: Children and Adolescents",2017,,Sociology,6,2,2459268
3026226,"Katherine Ognyanova",,NULL,138,1314,0235c0f59ff155d66ddc0df034393876f29c735f,"The COVID States Project #76: Storming of the Capitol, one year later",2022,,,0,1,3026226
116703389,"K. White",,NULL,13,43,023eb514fe0b80763a5cdc98ee3153efd36c7890,"The Case of “Misguided” “Thugs”",2017,,"Political Science",1,0,116703389
69362520,"J. R. Schement",,NULL,50,570,02518b34eab4d5bf72d2952dff03e36c3103ffdd,"THE INTERNATIONAL FLOW OF TELEVISION PROGRAMS",1984,,Sociology,20,12,69362520
7721216,"L. Mikesell",,NULL,54,834,02c22e28bdc51c72fa6afb5029647541c067bf11,"1. Grammar as a Complex Adaptive System",2009,,"Computer Science",0,0,7721216
7495433,"Lea P. Stewart",,NULL,45,1097,02d09ac28da8c006a75305e0f8ee4a5d6c7f89ce,"The Rules of the Game",1991,,"Computer Science",0,0,7495433
84651025,"Ralph A. Gigliotti",,NULL,58,460,02ea12e16721b1c80d57cd607c6dd2836f08a499,"Cultivating D ialogue: A Central Imperative for the Study and Practice of Servant L eadership",2016,,"Political Science",48,0,84651025
2604959,"L. Barkhuus",,NULL,109,3937,02ed872edc9a633055a75ef92fbcc7bc32560ecd,"Engaging the crowd: studies of audience-performer interaction",2008,"CHI Extended Abstracts","Computer Science",14,62,2604959
1767245,"M. Radford",,NULL,86,1504,033a19d6478c25a331a58f8c5bc4b588b58ed613,"(Measuring Research Impact) "I Stay Away from the Unknown, I Guess," Measuring Impact and Understanding Critical Factors for Millennial Generation and Adult Non-Users of Virtual Reference Services",2010,,Psychology,17,6,1767245
5255291,"Jennifer A. Theiss",,NULL,95,2177,0350d957b9adffefee8079bf9eeec723ea41840a,"Modeling Dyadic Effects in the Associations Between Relational Uncertainty, Sexual Communication, and Sexual Satisfaction for Husbands and Wives",2011,"Communication Research","Computer Science, Psychology",58,88,5255291
144689908,"K. Greene",,NULL,153,5390,037b7790813c3b11948c3960350353c93ccf4dd0,"Content Analysis of Trends in Print Magazine Tobacco Advertisements.",2015,"Tobacco Regulatory Science","Business, Medicine",50,30,144689908
3026226,"Katherine Ognyanova",,NULL,138,1314,039521652cf2505e43fb7c3c6b602e3acc73d233,"The COVID States Project #18: Fake news on Twitter",2021,,,0,5,3026226
3459190,"C. Senteio",,NULL,43,340,03b325f6af7e571899b1f9b66f567075ba2cc826,"Preventing Homelessness: An Examination of the Transition Resource Action Center",2009,"Journal of Prevention & Intervention in the Community",Medicine,14,15,3459190
1836413,"Melissa Aronczyk",,NULL,69,1109,040fe43a75dfbe0d122bba784b1f7915aa029b37,"When Corporations Care: A Reassessment of the Debunking Paradigm in Environmental Communication",2023,"Environmental Communication",,11,0,1836413
1795976,"J. Pavlik",,NULL,116,2654,0412bac76af3e4457e85ed7d1f6ee6845f3f83bd,"Trends in New Media Research: A Critical Review of Recent Scholarship",2013,,Sociology,5,23,1795976
5255291,"Jennifer A. Theiss",,NULL,95,2177,04199d54b84311fee11f7c5a372523f9b9768c5c,"Responsiveness and control in marital and parental communication: exploring interdependent relationships across family subsystems",2020,"Journal of Family Studies",Psychology,65,6,5255291
2604959,"L. Barkhuus",,NULL,109,3937,046b44feb097ef9d697397739b26be8ced15bcd0,""Mothers as Candy Wrappers": Critical Infrastructure Supporting the Transition into Motherhood",2019,"Proc. ACM Hum. Comput. Interact.","Psychology, Computer Science",70,22,2604959
1836413,"Melissa Aronczyk",,NULL,69,1109,04892ed083447eaf7c89f500cac5941c11330413,"Apprehending public relations as a promotional industry",2017,,"Political Science",94,14,1836413
50981816,"Britt S. Paris",,NULL,37,215,048dd4c4825ddfc813c1f79fd795688fd1df1ae0,"Back-ups for the future: archival practices for data activism",2018,,"Political Science",65,4,50981816
2604959,"L. Barkhuus",,NULL,109,3937,04d5486c1f19bc964fd88782b4f5efc0313edd40,"Editors' Welcome",2019,"Proc. ACM Hum. Comput. Interact.","Computer Science",0,0,2604959
144689908,"K. Greene",,NULL,153,5390,04d56097882c848a1a6431fc4d5b23260c7d205e,"Adolescent egocentrism and indoor tanning: is the relationship direct or mediated?",2015,"Journal of Youth Studies","Psychology, Medicine",54,5,144689908
3362498,"Shagun Jhaver",,NULL,38,1590,04d6dd7d33eede7225cc259ed1bdb13c3ba92aa9,"Decentralizing Platform Power: A Design Space of Multi-Level Governance in Online Social Platforms",2021,"Social Media + Society","Computer Science",206,9,3362498
7721216,"L. Mikesell",,NULL,54,834,04efeafc5356fc987927f754bc7716cd7adba4e7,"On using ethical principles of community-engaged research in translational science.",2016,"Translational research : the journal of laboratory and clinical medicine",Medicine,57,35,7721216
1795976,"J. Pavlik",,NULL,116,2654,04fe5ac3216f22267d6c0a29a63b8f3cfb278080,"Topographic spaces over ordered monoids",2015,,"Computer Science",18,1,1795976
2969386,"A. Spoerri",,NULL,32,931,05518629bbf7ed61da13939498809d5d155352d2,"How visual query tools can support users searching the Internet",2004,"Proceedings. Eighth International Conference on Information Visualisation, 2004. IV 2004.","Computer Science",22,12,2969386
2459268,"Dafna Lemish",,NULL,149,2723,0563036714204396f77e6c6ab80c3509419b2871,"Gender in children's television worldwide: Results from a media analysis in 24 countries",2008,,Geography,6,18,2459268
1795976,"J. Pavlik",,NULL,116,2654,0594ee25aa8fbec06e18b60ff3c149d6e356d982,"The Emergence of Augmented Reality (AR) as a Storytelling Medium in Journalism",2013,,Sociology,48,125,1795976
2604959,"L. Barkhuus",,NULL,109,3937,05a4ec27863c999c1f6423bfdd24fd3ba659597a,"Video microblogging: your 12 seconds of fame",2010,"CHI Extended Abstracts","Computer Science",7,9,2604959
2604959,"L. Barkhuus",,NULL,109,3937,05a5f7da9723f5f9113e811d3e11b0dad038dafd,"Social Infrastructures as Barriers and Foundation for Informal Learning: Technology Integration in an Urban After-School Center",2012,"Computer Supported Cooperative Work (CSCW)",,0,0,2604959
5255291,"Jennifer A. Theiss",,NULL,95,2177,05ac714fe9d0cc7dead59506653f311d59fbd214,"Relational Turbulence Within Military Couples During Reintegration Following Deployment",2014,,Engineering,69,12,5255291
84651025,"Ralph A. Gigliotti",,NULL,58,460,05cf99afafbd1cfb181f51df1d4d3aae7d749c9a,"Cultivating Alumni Engagement in Undergraduate Leadership Education: The Villanova University Student Leadership ForumXU",2015,,Sociology,24,6,84651025
144689908,"K. Greene",,NULL,153,5390,0621d369a3277f487b30bcfb1c60af856ca1e41f,"Sociocultural experiences, body image, and indoor tanning among young adult women",2017,"Journal of Health Psychology","Psychology, Medicine",44,13,144689908
1767245,"M. Radford",,NULL,86,1504,0622133aa3c82ed37d4feb8a2c2e4db0b4ad6b61,"Leading the reference renaissance : today's ideas for tomorrow's cutting-edge services",2012,,Engineering,0,0,1767245
1767245,"M. Radford",,NULL,86,1504,0624637f1949afa753fce57b017b4aa16b34128d,"Improving Business Access to Innovation Assistance across the Queensland Government",2016,,Business,0,0,1767245
5924217,"J. Mandelbaum",,NULL,33,892,06374789208e81b198781bc97f82a0ddefbf67a1,"Micro-moments of social support: Self-service-occasioned offers at the family dinner table",2021,"Communication monographs",,58,1,5924217
50981816,"Britt S. Paris",,NULL,37,215,06665780ba814af81752e40855095c05f9c3536f,"Constructions of exclusion: the processes and outcomes of technological imperialism",2018,,Sociology,4,0,50981816
1836413,"Melissa Aronczyk",,NULL,69,1109,0675260821cdf57dad1bac7846db4d709d0ae312,"Living the Brand: The Identity Strategies of Nation-Branding Consultants",2013,,Business,0,26,1836413
7721216,"L. Mikesell",,NULL,54,834,068e5b3003b1bad60e3d1132ea074ccc911a5266,"Adolescent and Parent Perceptions of Telehealth Visits: A Mixed-Methods Study.",2021,"Journal of Adolescent Health",Medicine,34,21,7721216
144689908,"K. Greene",,NULL,153,5390,069216da812ed14e93b9be29c1e2230d625badd3,"A snapshot of parenting practices useful for preventing adolescent vaping",2022,"Addictive Behaviors Reports",Medicine,62,2,144689908
116007957,"Dajung Woo",,NULL,28,208,07320c0ea4839ded860f7d2dd4dccd5632304ad9,"Collaboration Life Cycle: Communicating Knowledge and Expertise for Getting In, Getting On, and Getting Out",2017,,"Sociology, Computer Science",0,0,116007957
144689908,"K. Greene",,NULL,153,5390,07772276f889a81aa2b1f8c8b63a55c1a9a56c33,"An integrated model of health disclosure decision-making.",2009,,Business,0,146,144689908
3459190,"C. Senteio",,NULL,43,340,07867ec521a7263a113ee59e6a16776b6b1fbdfc,"Intergenerational Technology Transfer: Enhancing African American Older Adults' Self-Efficacy for Diabetes Self-Management",2021,"Progress in Community Health Partnerships Research Education and Action",Medicine,0,2,3459190
5947832,"Kristina M. Scharp",,NULL,75,1088,078a0171bd50f7ae6da22bcee7410e19700038d7,"Voicing the system: How formerly fostered adults make meaning of the U.S. foster care system",2020,,Psychology,39,4,5947832
144689908,"K. Greene",,NULL,153,5390,0794912c6771f80fd146ea460181c6aec383691e,"The Effect of Comparatively-Framed versus Similarity-Framed E-Cigarette and Snus Print Ads on Young Adults' Ad and Product Perceptions.",2016,"Tobacco Regulatory Science","Psychology, Medicine",54,12,144689908
73315821,"Brenda L. Boyer",,NULL,44,29,07a7f28697d8f463ed36c3416f037283b9b3e2bb,"LibGuides. Digital Citizenship. Plagiarism.",2012,,"Political Science",0,0,73315821
121149959,"Goun-ho Kim",,NULL,11,8,07af56d65778592cdfad2b6178f7afec1a97bdeb,"Operational Method of Archival Film and Visualization of History: Participation and Practice for Alternative History Writing",2023,"The Journal of Literature and Film",,0,0,121149959
1767245,"M. Radford",,NULL,86,1504,07c11b303795e4018baa4cc4b64ce881e9dce39a,"No more Lone Rangers: Setting the research and education agenda for collaborative information work in virtual environments",2010,,Engineering,4,0,1767245
5947832,"Kristina M. Scharp",,NULL,75,1088,07d2ec0efe59515e48357641a6249b27c4a700d3,"Exploring the Types of Stories Hearing Parents Tell About Rearing their Children Who Use Cochlear Implants",2020,"Ear and Hearing",Medicine,70,3,5947832
1767245,"M. Radford",,NULL,86,1504,07d560e75739328d79f9f957aac82f67ee7ae798,""They basically like destroyed the school one day": On Newer App Features and Cyberbullying in Schools",2017,"Conference on Computer Supported Cooperative Work","Psychology, Computer Science",48,35,1767245
14634426,"Sarah Shugars",,NULL,25,196,07da5b4e47dd34066c06b146cdb2999a9c20934c,"Microblog Conversation Recommendation via Joint Modeling of Topics and Discourse",2018,"North American Chapter of the Association for Computational Linguistics","Computer Science",50,29,14634426
2459268,"Dafna Lemish",,NULL,149,2723,07e21fadc5cb65386b692a7de9ffec84fcd23bdf,"Innovations in Gender Representation in Children ’ s Television The PRIX JEUNESSE 2016 Gender Prize Competition",2017,,,6,0,2459268
52100469,"J. Valenza",,NULL,62,88,07e4103f64601376640e0125dd477da324a590ce,"Towards an animal/tree/grass combination.",1980,,Biology,0,0,52100469
1767245,"M. Radford",,NULL,86,1504,07e6f9d466d90b86379b1c1efcac8f137824c2cb,"Researching in Times of Crisis: Toward Information‐Resilient Societies",2022,"ASIS&T Annual Meeting",Medicine,1,1,1767245
84651025,"Ralph A. Gigliotti",,NULL,58,460,07e7ab9ec9ed15f9ed700f7ac5c309004af21147,"Analysing the Dynamics of Crisis Leadership in Higher Education: A Study of Racial Incidents at the University of Missouri",2018,,"Political Science",59,22,84651025
14634426,"Sarah Shugars",,NULL,25,196,07faff86eaf355747f5cb02dc34e3317ae4cf7fa,"Feeling Like a Fraud: Imposter Syndrome in Political Science",2022,,,0,0,14634426
7495433,"Lea P. Stewart",,NULL,45,1097,08119edab9de4b610fd23c646348782443125a11,"Communication, Culture, and Organizational Processes",1985,,Sociology,0,95,7495433
1699369,"Venkata Rama Kiran Garimella",,NULL,72,2680,0819af991756aea28f9f83d83341dbc1ab780aa8,"Co-following on twitter",2014,"ACM Conference on Hypertext & Social Media","Computer Science, Physics",44,14,1699369
2604959,"L. Barkhuus",,NULL,109,3937,083d1979b02aee52ada89e5be5c2299a5801d7a7,"Session details: Workshops",2010,"UbiComp '10 Adjunct","Computer Science",0,0,2604959
3459190,"C. Senteio",,NULL,43,340,086111f3ffe053a891ef03f61bf154f4baf56521,"Addressing Disparities for Intersectional BIPOC Communities: The Hood Medicine Initiative Case Study",2021,EClinicalMedicine,Medicine,10,3,3459190
5722419,"Maria K. Venetis",,NULL,55,946,0862accc1d6daa1b34d390f1c6f02337ea5679ab,"Breast-Cancer Patients’ Participation Behavior and Coping During Presurgical Consultations: A Pilot Study",2015,"Health Communication",Medicine,49,17,5722419
84651025,"Ralph A. Gigliotti",,NULL,58,460,08683afdcf5552e22999a253d05233b69988d873,"Racial Incidents at the University of Missouri",2017,,"Political Science",15,25,84651025
5947832,"Kristina M. Scharp",,NULL,75,1088,089596e431a7abe5fb08dee547a93d31bac32884,"Thematic Co-occurrence Analysis: Advancing a Theory and Qualitative Method to Illuminate Ambivalent Experiences",2021,"Journal of Communications",Medicine,74,26,5947832
1767245,"M. Radford",,NULL,86,1504,0897796440c0cbaaead49adfd3c93aa558db6f25,"Collaboration in action: Enabling innovative scholarship with social and crowdsourcing services",2013,,"Political Science",0,0,1767245
52100469,"J. Valenza",,NULL,62,88,08e8fcceeb0cddc097a8f566b1cf09b58b21ec2f,"Children's Literature Resources on the Web.",1998,,Engineering,0,0,52100469
2604959,"L. Barkhuus",,NULL,109,3937,08fe7e708adf55061645ba5412dd3a251a6d21b3,"Interactive Performances as a Means of Social Participation and Democratic Dialogue",2014,,"Political Science",12,1,2604959
5722419,"Maria K. Venetis",,NULL,55,946,0919ae2735ebc81c142280ab62fe27b899e3a49d,"Breast cancer patients’ information seeking during surgical consultations: A qualitative, videotape‐based analysis of patients’ questions",2016,"Journal of Surgical Oncology",Medicine,53,14,5722419
5722419,"Maria K. Venetis",,NULL,55,946,093b7cae00f9f19d0569da1dad10f10681e0110b,"The Dyadic Communicative Resilience Scale (DCRS): scale development, reliability, and validity",2019,"Supportive Care in Cancer",Medicine,38,17,5722419
2604959,"L. Barkhuus",,NULL,109,3937,09584bd4dfb65391ab21edbbf22bb4204aeaeb04,"How Interaction Influences Academic Reading— a Comparison of Paper and Laptop",2021,"Social Science Research Network","Computer Science",40,0,2604959
2604959,"L. Barkhuus",,NULL,109,3937,097dc1d29b0d72758189978b1dc52870ebba2a85,"Making the city my own: uses and practices of mobile location technologies for exploration of a new city",2018,"Personal and Ubiquitous Computing","Computer Science",28,11,2604959
2519847,"Mark Aakhus","Rutgers University",https://comminfo.rutgers.edu/aakhus-mark,101,3475,0993d55950b2c619284fcc9c9dae26cf66bb6c2d,"Meaning/ful Work and Organizational Communication",2008,,Sociology,40,32,2519847
116007957,"Dajung Woo",,NULL,28,208,09a72513b4cef53d579d895e664a681bd2c95cd0,"“I Value Collaboration but Won’t Get Pushed Around”: Uncovering Tensions in Millennials’ Vocational Anticipatory Socialization",2022,"Western journal of communication",,39,0,116007957
5255291,"Jennifer A. Theiss",,NULL,95,2177,09acec875010b287c679376413f18f4c1f8106bd,"A Relational Turbulence Model of Military Service Members' Relational Communication During Reintegration",2013,,Psychology,57,50,5255291
2604959,"L. Barkhuus",,NULL,109,3937,09dc59aa98ef5e7c9fa6952798697f68c192f333,"Location-Based Services for Mobile Telephony: a Study of Users' Privacy Concerns",2003,"IFIP TC13 International Conference on Human-Computer Interaction","Computer Science, Business",15,491,2604959
5947832,"Kristina M. Scharp",,NULL,75,1088,09e72af0bc6155a88be9bc1fd81e23564f64c7c2,"A (In)curable Disease? Making Meaning of Addiction from the Perspective of People in Recovery from Opioid Use Disorder",2022,"Health Communication",Medicine,28,3,5947832
2855416,"Marija Dalbello",,NULL,45,296,0a24bd89a94168e4cd465eaea95e7aa3c25c350b,"Institutional Shaping of Cultural Memory: Digital Library as Environment for Textual Transmission1",2004,"Library quarterly",Sociology,47,39,2855416
1795976,"J. Pavlik",,NULL,116,2654,0a26b7ce954cb64a8bf1512ec1d4ab9bfc88062d,"Broadcast and New Media Use in China: Findings from a National Survey FEI SHEN, ZHI’AN ZHANG, AND MIKE Z. YAO",2015,,Sociology,0,0,1795976
5722419,"Maria K. Venetis",,NULL,55,946,0a2bd7213e4b835bbc72df3a018b3f20e001a7b4,"Decision-Making Criteria When Contemplating Disclosure of Transgender Identity to Medical Providers",2021,"Health Communication",Medicine,54,15,5722419
3026226,"Katherine Ognyanova",,NULL,138,1314,0a3eba1e7323a9833b1a5bfdfbff5f42096af45a,"The COVID States Project #70: MA Governor Charlie Baker's Approval",2021,,,0,1,3026226
48264400,"Lauren A. Feldman",,NULL,66,3292,0a4ac0286a711b24223ca51e0fdd78c62dd0b5a4,"Using Political Efficacy Messages to Increase Climate Activism",2016,,"Political Science",53,142,48264400
13241733,"Galina B. Bolden",,NULL,56,2673,0a533cd779d9a14a1c176a59bfb39e41ac62d450,"Getting Started with Transcription",2017,,Biology,0,2,13241733
116307858,"Regina M. Marchi",,NULL,33,470,0a784cf99f1a651456cf4fbbdabc1e88c9454558,"Altar images : US Day of the Dead as political communication",2005,,"Political Science",0,3,116307858
144689908,"K. Greene",,NULL,153,5390,0ab9a6abe20e62f1026741dc42b4ee5594a0fca6,"Parents’ Intentions, Concerns and Information Needs about COVID-19 Vaccination in New Jersey: A Qualitative Analysis",2023,Vaccines,Medicine,80,2,144689908
66629962,"N. Linardopoulos",,NULL,5,20,0abb083064bc5bd1c1bccface600f14ee8822d87,"RETHINKING TEACHING AND LEARNING IN A LARGE LECTURE COMMUNICATION COURSE",2023,"EDULEARN Proceedings",,0,0,66629962
2604959,"L. Barkhuus",,NULL,109,3937,0acdcd4215e5e64c6ed223f7a159dc3ed495207e,"Editor's Welcome",2020,"Proc. ACM Hum. Comput. Interact.","Computer Science, Sociology",0,0,2604959
2519847,"Mark Aakhus","Rutgers University",https://comminfo.rutgers.edu/aakhus-mark,101,3475,0ad7f2a171da56e64a9407fa1455577bf363b8db,"Communication Norms on organizational theory and research : The case of contracting for supply chain management",2012,,Psychology,0,0,2519847
2604959,"L. Barkhuus",,NULL,109,3937,0b06b9c367c5195f374b4ab9d1b2fa22570edf31,"TagPad: Supporting Field Interviews and Analysis",2013,,Psychology,16,0,2604959
144689908,"K. Greene",,NULL,153,5390,0b13f54980a20ae98ae842875d2808fd45e33a1e,"Who Watches Verbally Aggressive Shows?",2009,"J. Media Psychol. Theor. Methods Appl.","Psychology, Computer Science",71,12,144689908
5722419,"Maria K. Venetis",,NULL,55,946,0b1d440c1778ce8a92e5edc844dcc545b672bb31,"Understanding the multi-dimensional nature of informational language in health care interactions",2020,,Psychology,43,1,5722419
1699369,"Venkata Rama Kiran Garimella",,NULL,72,2680,0b30627874619cb8bc8d283d4835267b5ea6eaaf,"Discovering the Network Backbone from Traffic Activity Data",2014,"Pacific-Asia Conference on Knowledge Discovery and Data Mining","Computer Science",92,4,1699369
84651025,"Ralph A. Gigliotti",,NULL,58,460,0b4cadcde1064e84a2741a0e4980616ed703a60e,"An exploratory study of academic leadership education within the Association of American Universities",2017,,"Political Science",25,16,84651025
2898940,"Marya L. Doerfel",,NULL,43,1692,0b5f3eb5a0578428cc688b6e6a6d4878a46c0938,"Network dynamics of interorganizational cooperation: the Croatian civil society movement",2004,,Sociology,56,86,2898940
2969386,"A. Spoerri",,NULL,32,931,0b60e8c895f9edd345f027f3075b550909f9cf70,"Visual search editor for composing meta searches",2005,"ASIS&T Annual Meeting","Computer Science",20,7,2969386
5722419,"Maria K. Venetis",,NULL,55,946,0b76c42fd27bae4101123923b969175f5581f5d5,"“He would never let me just give up”: Communicatively Constructing Dyadic Resilience in the Experience of Breast Cancer",2018,"Health Communication","Psychology, Medicine",44,37,5722419
50981816,"Britt S. Paris",,NULL,37,215,0bd031b4584add8be496eea81554c217ca1da672,"The Decoy Effect and investors' stock preferences",2012,,Business,4,1,50981816
13241733,"Galina B. Bolden",,NULL,56,2673,0bd33c292d76fcc16dba64f19b29b5509d460f56,"Over-Exposed Self-Correction: Practices for Managing Competence and Morality",2022,"Research on Language and Social Interaction",,67,6,13241733
2459268,"Dafna Lemish",,NULL,149,2723,0bf5403e8dcc491c337dfd952817587496f8008f,"Gender: Representation in the Media",2012,,Sociology,3,13,2459268
47084399,"K. Costello",,NULL,31,583,0c740e7e6b2f4dbd2f0cac3a903a9f9068b5a55e,"Online Organ Solicitation: Finding a Kidney Donor Using the Internet from the Solicitor’s Point of View",2012,,Psychology,0,0,47084399
1767245,"M. Radford",,NULL,86,1504,0cb5bc7ee5baaac98411283db623221919658f31,"Work values in cross-national perspective: Some observations from applied research",1994,,Sociology,15,1,1767245
69362520,"J. R. Schement",,NULL,50,570,0cb6da421f7f23ee33e8ab1a4b2352ad2ae8f532,"Beyond universal service: Characteristics of Americans without telephones, 1980-1993",1995,,Economics,2,42,69362520
2855416,"Marija Dalbello",,NULL,45,296,0cc3d847ce5d63104d18c5dc0b19b445af946600,"Architectures of Knowledge and Literary Tradition: A History of the Almanac in Croatia",2003,,Sociology,83,1,2855416
1767245,"M. Radford",,NULL,86,1504,0ce0bdcd37eb26dc0ce6d3542bf7a077ef5a929e,"Book availability: Academic library assessment",1994,,Sociology,12,9,1767245
13241733,"Galina B. Bolden",,NULL,56,2673,0ced825cbd8a8e2173dda4a6432091e26f2ec99a,"The use of conversational co-remembering to corroborate contentious claims",2017,,Psychology,47,13,13241733
2459268,"Dafna Lemish",,NULL,149,2723,0d27e30d30f00c7819ddf4fd9a39126d2c8b9204,"Social Group Stories in the Media and Child Development",2017,Pediatrics,Medicine,33,14,2459268
1795976,"J. Pavlik",,NULL,116,2654,0d50a9abffb58bd762948a84bcf6d4f949659567,"Media adaptation in the Gulf",2018,,Geography,0,0,1795976
13241733,"Galina B. Bolden",,NULL,56,2673,0d8fe84b585e364688391403b5c250d2133e6964,"Engaging with Clients’ Requests for Medication Changes in Psychiatry",2020,,Medicine,41,1,13241733
